"video_id","title","published_at","channel_title","duration"
"AHNre6MvKPw","PETITION TO OUST MIKE SONKO FROM OFFICE AS HE WAS COMPUTER GENERATED~OPINION 2017","2017-09-18T16:31:22.000Z","Raila Odinga vs Uhuru Kenyatta 2017","PT39M36S"
"Nk31WFcgho0","RAILA HAS  SUCCESSFULLY TRAPPED UHURUTO IN A POLITICAL CRISIS AS   IEBC FACE CHANGES","2017-09-18T15:20:40.000Z","Kenya News Alert TV","PT1H7M10S"
"p6HFI8HtJ9o","Ruto confident that jubilee party will emerge victorious","2017-09-18T14:39:03.000Z","KBC Channel 1","PT4M26S"
"zJVF-ZfG7ys","Caroline Mutoko: Centonomy Entrepreneur - Mental Shift is needed","2017-09-18T14:36:47.000Z","Caroline Mutoko","PT5M53S"
"nmxR14_bL6Q","FORMER MINISTER OF TOURISM & CULTURE FATOU MASS JOBE TESTIFIES AT THE COMMISSION OF INQUIRY","2017-09-18T14:34:00.000Z","From Gambia","PT40M54S"
"w9ZnCzddu0w","President Trump United Nations General Assembly:  Reforming The UN 9/18/17","2017-09-18T14:17:51.000Z","LIVE ON-AIR NEWS","PT13M17S"
"uEHLAH2p9jw","President Trump: United Nations is not living up to its potential 9/18/17 - UN General Assembly","2017-09-18T14:08:51.000Z","LIVE ON-AIR NEWS","PT4M37S"
"uXOLIr-Juq0","Raila Odinga Calls Uhuru  and Ruto Election thieves and MUST VACATE STATEHOUSE","2017-09-18T13:34:38.000Z","Lee Makwiny","PT19M48S"
"Gpk1mbkfXBQ","William Ruto SHAMELESSLY ATTACKS Raila Odinga Over IEBC Which is NOT Prepared For Elections","2017-09-18T13:17:39.000Z","Raila Odinga vs Uhuru Kenyatta 2017","PT3M27S"
"yqzayYOKYuY","MOSES KURIA reveals the SHOCKING truth about RAILA ODINGA","2017-09-18T13:10:25.000Z","William Ruto TV","PT4M55S"
"cJ33HkJRpDg","Hon. Monica Amonding on Age Limit, Finds Consolation in the Bible","2017-09-18T13:05:37.000Z","NBS TV Uganda","PT4M30S"
"9nd6d0k_7so","Nasa now Drags safaricom and Telkom into the IEBC Saga","2017-09-18T12:59:18.000Z","ARAP KALYA","PT8M"
"ytC1SYSN3AM","I lost 15 elections because of my looks, says Deputy Speaker Moses Cheboi","2017-09-18T12:59:00.000Z","Capital FM Kenya","PT2M9S"
"CIy_4bT4EIc","Omubaka Muhammad Nsereko Ayanukudde Poliisi ku Ky'emyaka","2017-09-18T12:50:27.000Z","NBS TV Uganda","PT5M5S"
"Dp1yiSFVWIM","FORMER GOVERNOR OF WEST COAST REGION AMINATA SAFIYATOU HYDARA TESTIFIES AT THE COMMISSION OF INQUIRY","2017-09-18T12:36:34.000Z","From Gambia","PT56M22S"
"syTqH0P8gp4","Raila Odinga FULL Press Conference Today 9/18/17 NASA Press Conference Today","2017-09-18T12:36:34.000Z","Raila Odinga vs Uhuru Kenyatta 2017","PT19M48S"
"zp3Vr9QV6SQ","No reforms , no elections NASA demands changes at IEBC","2017-09-18T12:09:50.000Z","Kenya NTV","PT2M31S"
"57SIzyhCdbM","NTA News Panaroma 18/sep/2017","2017-09-18T11:58:22.000Z","NTA News","PT24M4S"
"5Kr07vaKwO4","Over 5 companies ready to install election system in 3 weeks - Raila","2017-09-18T11:32:24.000Z","DailyNation","PT16M43S"
"XY31rNawd-w","RAILA TO EXPOSE SAFARICOM & TELKOM FOR STEALING VOTES","2017-09-18T11:26:36.000Z","ChannelYakele","PT14M17S"
"CRBn3ZyHv_E","Raila Odinga Now Warns William Ruto, NASA Press Conference","2017-09-18T11:22:57.000Z","TopGuy360 KENYA","PT2M48S"
"gB21mVIcxGQ","A Story a Day Episode 18: Rwanda","2017-09-18T11:11:53.000Z","Hot 96 FM Kenya","PT14M14S"
"mqxhNa7DurM","Push for dialogue between NASA and Jubilee by foreign envoys (Part 4)","2017-09-18T10:53:35.000Z","K24TV","PT29M54S"
"Sbj7LzzqKXE","Asif Ali Zardari Press Conference | 18 September 2017 | Bol TV","2017-09-18T10:23:12.000Z","Power TV Talk Shows","PT7M23S"
"AUGMs9lt76Q","Effects of presidential election poll date change to Kenyans","2017-09-18T10:14:08.000Z","Hot 96 FM Kenya","PT13M46S"
"OiQbZ0FVTu0","Narok leaders adopt a door to door campaign strategy in support of Pres.Kenyatta","2017-09-18T10:10:59.000Z","K24TV","PT2M3S"
"etS-b-0n0P8","Push for dialogue between NASA and Jubilee by foreign envoys (Part 3)","2017-09-18T09:26:41.000Z","K24TV","PT23M55S"
"Dl9CooqmJbs","CHEATING ALERT - Obwenzi bwa Diamond Platnumz bugenda kusuula Zari e dalu","2017-09-18T09:10:30.000Z","Trending Uganda","PT29M56S"
"ps083HpDM_w","Hon.   Frank Tumwebaze on Presidential Age Limit Debate","2017-09-18T08:54:40.000Z","NBS TV Uganda","PT54M15S"
"pJExrjjcsz4","Kurung'a Igiri: Itemi ria kanitha uteti-ini","2017-09-18T08:48:44.000Z","Kameme Tv Old","PT48M"
"xGHSiy-Q07M","James Orengo Campaigns for Raila in Meru |FlipTv","2017-09-18T08:43:32.000Z","Flip Tv Kenya","PT3M10S"
"KcPBptvmRyM","Stakeholders meet to discuss the PSV ban from the CBD","2017-09-18T08:38:06.000Z","KTN News Kenya","PT8M7S"
"VMsdLpQLEyQ","LIKE IT OR NOT THERE SHALL BE NO CHANGES AT IEBC WILLIAM RUTO","2017-09-18T08:09:45.000Z","BREAKING NEWS KENYA","PT1M59S"
"Ul0T9an6kzk","No elections till our demands on IEBC reforms are considered - James Orengo","2017-09-18T07:26:57.000Z","DailyNation","PT3M26S"
"a2YbGCmYV9I","Kikuyus will NOT Vote For Uhuru. Raila will win Kikuyu Votes After He Did This to Kikuyus","2017-09-18T07:03:37.000Z","E News Kenya","PT1M32S"
"goQcOHi5jto","K24 Alfajiri: KIM Women In Leadership Conference 2017","2017-09-18T06:09:16.000Z","K24TV","PT15M34S"
"O1gqXz1WFhg","Kwibanga: Tukimurika uciari na ureri Ep 22 Prt 1","2017-09-18T05:39:42.000Z","Kameme Tv Old","PT44M39S"
"tf5qp73TMnE","Al Ghurair, OT-Morpho, under fire secretariat; Why IEBC is wallowing in its own mess - AMLiveNTV","2017-09-18T05:33:39.000Z","Kenya NTV","PT1H18M59S"
"_w-VRkLvVjc","KIHARU MP SAYS UTHAMAKI MUST BE PROTECTED AT ALL COST BY SENDING RAILA TO BONDO","2017-09-18T02:54:50.000Z","Kenya News Alert TV","PT2M29S"
"MuG2daR0RjA","UHURUTO TELLS NASA THAT THERE SHALL BE NO CHANGES AT IEBC","2017-09-18T02:14:20.000Z","Kenya News Alert TV","PT1M42S"
"d_fDucJ1GaE","KENYANS BAYS  FOR RUTO'S BLOOD  AS HE  CALLS RAILA THE MASTER OF COUPS,VIOLENCE & BLOODSHED","2017-09-18T01:47:02.000Z","Kenya News Alert TV","PT7M5S"
"pM7s8dF-sWg","MOSES SHOCK MOURNERS   TO WHAT  HE SAID ABOUT RAILA IN  PRESENCE OF OLE KAPARO","2017-09-17T22:43:54.000Z","Kenya News Alert TV","PT2M59S"
"fFauoJ758cs","Nasa wants IEBC officials sacked as Jubilee stands its ground on fresh presidential election","2017-09-17T22:10:34.000Z","Kenya NTV","PT30M41S"
"qTk7Et3jfuM","Raila Odinga  Speech In NASA Rally In Jacaranda Grounds Embakasi Nairobi County 9 17 17","2017-09-17T21:38:56.000Z","Trending News Kenya","PT43M52S"
"sSXoxwa6bB8","NTA Network NewsLine With Becky from Lagos Centre 17/9/17","2017-09-17T21:38:20.000Z","NTA News","PT1H28M28S"
"__D3hCwuvPQ","Miguna Miguna Calls William Ruto a Demagogue  and Chebukati a Buffoon!!","2017-09-17T20:59:47.000Z","Lee Makwiny","PT5M22S"
"uDeY5PgyGoY","Jubilee woos Nairobi : William Ruto says NASA plans to cause chaos","2017-09-17T20:46:46.000Z","KTN News Kenya","PT4M5S"
"yQDgXK4wnsI","WOMAN WITHOUT LIMITS: DONNIE McCLURKIN PT.2B","2017-09-17T20:11:12.000Z","Rev Kathy Kiuna","PT25M"
"e1yvC6ca9Uk","Raila Odinga HEROIC Reception Ahead Of Jacaranda Rally Today 9/17/17","2017-09-17T19:45:02.000Z","Raila Odinga vs Uhuru Kenyatta 2017","PT1M"
"q4HNHyjEdkw","WHO IS DAVID MARAGA~FULL INTERVIEW","2017-09-17T19:40:04.000Z","Raila Odinga vs Uhuru Kenyatta 2017","PT31M12S"
"ei9FetX8Zrk","KIEMS kit firm OT MORPHO credibility comes into question as it emerged it  paid bribes","2017-09-17T19:37:22.000Z","Kenya NTV","PT3M21S"
"Po9bsXvVbc8","Check Point : Reforms or no reforms","2017-09-17T19:35:57.000Z","KTN News Kenya","PT42M36S"
"kHv2e_VW_HA","DP Wiliam Ruto claims Nasa want to force a coalition government","2017-09-17T19:30:25.000Z","Kenya NTV","PT2M19S"
"h0DDpSwNdpM","Nasa unveils plans to force 12 officials out, accuses IEBC of colluding with OT Morpho","2017-09-17T19:29:19.000Z","Kenya NTV","PT3M22S"
"TnDdWX9Pgwg","Game Plan 2017: IEBC reforms standoff","2017-09-17T19:28:23.000Z","Kenya CitizenTV","PT27M55S"
"39z1VsQ5pso","Mutamburuko wa Mohoro: Uteti guuku bururi-ini mbere ya githurano gia gucokerwo kia upresident","2017-09-17T18:34:09.000Z","Kameme Tv Old","PT13M12S"
"K97qCESVPJc","Mr Speaker sir : Kenneth Lusaka political history","2017-09-17T18:16:28.000Z","KTN News Kenya","PT4M54S"
"9L8jU_7_9Ck","NASA Campaigns : Raila Odinga says Jubilee and IEBC are partners","2017-09-17T18:07:02.000Z","KTN News Kenya","PT6M8S"
"EC0A7J5YLRM","DP Ruto tells NASA to stop threats of blocking IEBC from presiding over polls","2017-09-17T18:05:56.000Z","K24TV","PT2M59S"
"XrFMDtB5YcQ","Kirirmbi : NASA irenda mendekithia mao marumirirwo [PART 2]","2017-09-17T18:01:37.000Z","iNooro TV","PT24M1S"
"GOkWQYFkHig","Raila: Salvage what you can and run,there will be no election with you in office","2017-09-17T18:01:21.000Z","K24TV","PT3M34S"
"hhihyIzfFps","The golden music of Super Mazembe band...The legend Kasongo","2017-09-17T17:51:05.000Z","Churchill Show","PT6M"
"7CFpBS9-QOY","NASA launches campaign to push out top IEBC officials","2017-09-17T17:20:00.000Z","K24TV","PT3M5S"
"JMm2Fih6k40","KOCHA WA MWADUI FC AFUNGUKA BAADA KUPOKEA KIPIGO DHIDI YA SIMBA SC.","2017-09-17T16:44:44.000Z","ShutikaliTV","PT1M9S"
"zq5fOJpeygo","JUBILEE SAYS THEY ARE DETERMINED TO SEND RAILA TO BONDO","2017-09-17T16:42:47.000Z","Kenya News Alert TV","PT7M50S"
"DaNdmUr7OBI","Sohail Warraich Response On NA 120 Elections","2017-09-17T16:11:13.000Z","Pak Royal Media","PT3M8S"
"6tvu1pbmnlc","Union Home Minister Rajnath Singh Speech at Sankalpa Sabha | Nizamabad | Studio N","2017-09-17T15:14:12.000Z","Studio N News","PT1M30S"
"00Ff3dRlfSo","JOHN KERRY APOLOGIZED TO RAILA - KALONZO","2017-09-17T15:01:24.000Z","ChannelYakele","PT13M51S"
"6yHsdarCCZo","Venkaiah Naidu Speech in ANR National Award 2017 for Movie Director Rajamouli | Hyderabad | Studio N","2017-09-17T14:54:36.000Z","Studio N News","PT20M20S"
"4-3WVa-e1CY","Tammareddy Bharadwaja Speech at Studio N Channel Journalist Training classes | Studio N","2017-09-17T14:30:19.000Z","Studio N News","PT1M11S"
"ezDGLvONYxw","Tammareddy Bharadwaja Speech at Studio N Channel Journalist Training classes | Studio N","2017-09-17T14:29:38.000Z","Studio N News","PT3M17S"
"LvRY9uoKu1Y","OVERWHELMING SPEECHES AT NASA MEGA RALLY AT JACARANDA GROUND TODAY","2017-09-17T13:55:40.000Z","KENYA LATEST NEWS 2017","PT1M35S"
"uuiE5w4lfOY","""We are ready to meet Uhuru and Ruto on a level playing field..."" Raila Odinga","2017-09-17T12:22:28.000Z","KTN News Kenya","PT2M30S"
"xE4L0qmil9c","Full Coverage of President Buhari's Departure To New York For #UNGA 17/9/2017","2017-09-17T10:14:41.000Z","NTA News","PT56M17S"
"OOEPsialKEc","NASA remain adamant on fresh poll boycott if reforms are instigated","2017-09-17T09:59:28.000Z","KTN News Kenya","PT36M26S"
"pKFP71j0B_0","RAILA ODINGA NAMES OFFICIALS FROM 3 COUNTIES WHERE FAKE FORMS WERE USED TO DECLARED PRESIDENTIAL RES","2017-09-17T09:41:54.000Z","KENYA LATEST NEWS 2017","PT10M41S"
"-XcaR6i3aTE","ITS WASN'T NGUNJIRI PETITION BUT UHURU'S ~RAILA ODINGA BOMBSHEL TO UHURU KENYATTA","2017-09-17T08:47:42.000Z","KENYA LATEST NEWS 2017","PT3M44S"
"-w-upaeRG4w","PM Narendra Modi Speech At Inauguration of Sardar Sarovar Dam | Gujarat | Studio N","2017-09-17T08:45:40.000Z","Studio N News","PT2M45S"
"AKqXrFUeK-s","AP CM Chandrababu speech at Regional Conference On Environment- 2017 | Vizag | Studio N","2017-09-17T08:34:48.000Z","Studio N News","PT8M45S"
"sUql_9XW6bk","Do you support Ngunjiri Wambugu's petition to remove CJ Maraga? (Part 1)","2017-09-17T07:31:37.000Z","K24TV","PT12M11S"
"3XElVRWP2A8","Vice President Venkaiah Naidu speech at lay foundation stone for RVTI | Hyderabad | Studio N","2017-09-17T04:40:18.000Z","Studio N News","PT2M30S"
"wOSB_uAI9Lk","OU Professor PL Visweswara Rao Speech at Journalists Training Classes | Part 6 | Studio N","2017-09-16T09:08:44.000Z","Studio N News","PT44M37S"
"AP4xgsDad8Q","Business Editor Brahmachary Speech in Studio N Channel Journalists Training Classes | Studio N","2017-09-16T09:08:37.000Z","Studio N News","PT32M37S"
"-E_T6ZSV1XI","Nara Brahmani Celebrations Speech In Heritage Silver Jubilee Function","2017-09-16T04:56:46.000Z","World News Telugu","PT3M37S"
"HJx5kHYmi5E","Live Stream  St Louis Protest after not guilty verdict","2017-09-16T04:42:45.000Z","lucky43113","PT3H35M1S"
"Cdv1dSpVZ6M","**LIVE** MULTI-VIEW of St. Louis, MO Protest - Over Innocent Verdict of Jason Stockley","2017-09-15T21:21:19.000Z","Authentic Intent","PT2H16M12S"
"zMK37TvO5hI","Nyeri Town MP says he will not pursue petition against CJ","2017-09-15T18:54:55.000Z","Kenya NTV","PT3M51S"
"iJmoSFomqf4","Ngunjiri Wambugu withdraws petition seeking to oust CJ Maraga","2017-09-15T18:01:57.000Z","K24TV","PT3M24S"
"jFw_gfE8-ug","Aden Duale defends Jubilee in the  on the move to oust CJ Maraga","2017-09-15T12:41:24.000Z","KTN News Kenya","PT5M3S"
"ABYFUg9eKZA","Duale, Murkomen say Jubilee party did not sponsor petition against CJ","2017-09-15T11:30:21.000Z","Kenya NTV","PT4M18S"
"iVebnd_rYTE","Thirdway Alliance slams what it terms as intimidation of Judiciary","2017-09-15T11:08:17.000Z","Kenya NTV","PT44S"
"-QjHcy0CzBI","Duale, Murkomen pressure Wambugu to withdraw petition","2017-09-15T11:05:35.000Z","Capital FM Kenya","PT1M16S"
"LrAy_4ggvb8","Watch the latest news updates on #NTVToday #ElectionsKE","2017-09-15T10:07:10.000Z","DailyNation","PT2H8M21S"
"I0JA1qVN420","Aden Duale comments on the petition against CJ David Maraga","2017-09-15T07:51:20.000Z","KTN News Kenya","PT2M55S"
"60-jW8DjGRQ","DP Ruto exudes confidence that Uhuru Kenyatta will defeat Raila Odinga","2017-09-15T07:33:07.000Z","KTN News Kenya","PT2M16S"
"SgaKIbIHP1Q","President Uhuru Kenyatta's hold of Gusii gets tainted by MP Ngunjiri's war with CJ Maraga","2017-09-15T05:04:07.000Z","KTN News Kenya","PT8M38S"
"wF4LDUOxaD4","The Late Otieno Kajwang Speech that is still  haunting Statehouse and IEBC","2017-09-15T04:40:16.000Z","Lee Makwiny","PT2M55S"
"FH_Zge5Ki9g","The possibility of Cj Maraga's exit lies with Nyeri MP Ngunjiri Wambugu's petition at the JSC","2017-09-15T04:35:24.000Z","KTN News Kenya","PT13M23S"
"OFdpGvuk29U","Pro CJ David Maraga demonstrations held in Kisii","2017-09-14T18:31:28.000Z","Kenya NTV","PT1M22S"
"o3feHTzz_PA","MP Ngunjiri Wambugu files petition to oust Chief Justice David Maraga","2017-09-14T18:31:24.000Z","Kenya NTV","PT3M30S"
"G3_jfiRc8P0","Jubilee Party denies knowledge of Ngunjiri petition","2017-09-14T18:00:06.000Z","K24TV","PT3M5S"
"h_pfvFNmGKw","Jubilee MP petitions Judicial Service Commission for removal of CJ Maraga","2017-09-14T16:26:03.000Z","Capital FM Kenya","PT45S"
"64701erYCt8","Acting Interior Secretary Fred Matiangi makes an address during a security meeting in Mombasa","2017-09-14T11:36:11.000Z","KTN News Kenya","PT8M35S"
"r4-QG3LT2Kw","Mutula Kilonzo Junior senator Makueni county on Maraga Ouster bid","2017-09-14T11:28:06.000Z","KTN News Kenya","PT9M20S"
"DVycbAq9sD8","NGUNJIRI WAMBUGU WANTS CJ DAVID MARAGA OUT","2017-09-14T11:21:00.000Z","KenyaBreaking Newz","PT12M55S"
"BsA2WQA1zUc","Ruto in Vihiga","2017-09-14T10:44:23.000Z","kute543","PT2M3S"
"y184gMi9HlM","NOAA: Causes Floods & NASA Controls Space Land! Geoengineering & Weaponize Weather by NASA/ MIRROR","2017-09-14T10:33:35.000Z","Mrz. Toni FREENEY","PT31M11S"
"CI_2WD07akA","JUBILEE SHOCKED: Kisii delegates dancing to NASA song after Nakuru State House cash handout","2017-09-14T10:19:57.000Z","Migori News","PT3M12S"
"GYOX2I-urFk","Nasa WajiNasa","2017-09-14T09:57:20.000Z","Raila The Loser","PT58S"
"sEZNSv5mNZk","Mkutano wa usalama: Waziri Matiang'i aandaa mkutano Pwani","2017-09-14T09:33:32.000Z","KTN News Kenya","PT2M41S"
"oJE92WfJbrU","Viongozi wa chama cha Jubilee Kirinyaga wamsuta Martha Karua kuwa anaeneza siasa za Raila","2017-09-14T09:32:20.000Z","KTN News Kenya","PT1M45S"
"IGAJ9rBm49w","Jubilee can run parliament without a single Nasa MP","2017-09-14T09:31:40.000Z","Charity Cherotich","PT4M45S"
"VxTAaSbBc_U","Mutuas Uhuru Campaign In Tala Flops: Impossible To Sell Uhuru In Ukambani","2017-09-14T09:26:56.000Z","Kumekucha Chris","PT1M36S"
"GZHUgGEgx4M","Viongozi wa dini Kisumu wazungumzia fujo zilizofanyika Kisumu","2017-09-14T09:20:13.000Z","KTN News Kenya","PT8M41S"
"WAmVSkvCAy8","Mkutano wa viongozi wa Abagusii Nakuru wapuuzwa na magavana wa eneo la jamii ya Kisii Luhya na Waluo","2017-09-14T09:08:22.000Z","KTN News Kenya","PT2M12S"
"qqdSBjGbmmU","KISII DELEGATION MOCKS UHURU AFTER THEIR NAKURU STATEHOUSE MEETING","2017-09-14T09:04:03.000Z","Mambo Ya Kenya Haya 2017","PT3M4S"
"3niwVePacgQ","Sodaweynti Hussein Weytan","2017-09-14T08:54:10.000Z","aminkey cade","PT33S"
"DJ7PecMDXDg","Funniest Dj shiti's compilations","2017-09-14T08:37:03.000Z","Charity Cherotich","PT6M24S"
"P9MRNMHVgqM","NASA declines to meet IEBC officials; claiming that invitation came late","2017-09-14T08:24:32.000Z","KTN News Kenya","PT1M3S"
"IhB6svPlKt0","APSRTC NMU EMPLOYEES GOLDEN JUBILEE CELEBRATIONS BY AP CM AT PADMAVATHI GHAT, VJA ON 12092017","2017-09-14T08:23:02.000Z","I&PR AP","PT33M51S"
"Lec_4WPXCeM","SHAME! KISII/ABAGUSII LEADERS FIGHT FOR FOOD AT STATEHOUSE NAKURU","2017-09-14T08:11:06.000Z","Trending Topics with Lizzie","PT49S"
"NNSNWEzGltk","MARAGA UNDER SIEGE: Grounds on which Chief Justice can be removed from office","2017-09-14T08:11:00.000Z","KTN News Kenya","PT2M12S"
"4qydTkQaYuo","""Justice Maraga doesn't recognise Uhuru as president,"" Hon. Ngunjiri Wambugu","2017-09-14T07:57:40.000Z","KTN News Kenya","PT12M55S"
"x_nO-L5X_Kk","GOVERNOR MUTUA GETS BULLIED BADLY  AGAIN AT TALA NASA !NASA!NASA!WAKAMBA NI NASA.","2017-09-14T07:25:22.000Z","Trending News Kenya","PT1M36S"
"yffaxlPASgY","Uhuru Challenge / Ngong hills Vlog","2017-09-14T06:57:50.000Z","Keneth Mueke","PT8M33S"
"Nyf6evow8Hs","MARAGA UNDER SIEGE: Jubilee MPs file a petition against Chief Justice David Maraga","2017-09-14T06:40:05.000Z","KTN News Kenya","PT6M7S"
"k_IoP10IKx4","Main suspect behind Moi Girls fire released on 200,000 bail","2017-09-14T06:27:39.000Z","KTN News Kenya","PT1M21S"
"P3SQpoZLkhA","Papa Dennis on paying it forward #BetterLivingKE","2017-09-14T06:22:56.000Z","Kenya NTV","PT15M37S"
"gsuFGBRKWfc","Three kenyans move to court to block IEBC from conducting the October elections","2017-09-14T06:05:56.000Z","KTN News Kenya","PT3M27S"
"zF_kqcTW5UI","Nara Brahmani Excellent Speech at Heritage Silver Jubilee Celebrations | Balakrishna | Lokesh","2017-09-14T05:30:05.000Z","Showing Cinema","PT3M48S"
"Wp13pNILmuU","Sarah Sanders White House Press Briefing on President Donald Trump Latest News 9/13/17 Trump News","2017-09-14T05:25:24.000Z","PRESIDENT DONALD TRUMP NEWS & LIVE SPEECH 2017","PT26M4S"
"BQr6xZ4e0eU","Kalonzo Musyoka behavior that left Wiper Leaders SHOCKED!! ||Mr. C.E.O","2017-09-14T05:10:52.000Z","Mr. C.E.O","PT1M57S"
"KkRDiJ_avxI","Minister Nara Lokesh Speech at IIA 2017 || Telugu Hungama","2017-09-14T04:22:18.000Z","Telugu Hungama","PT15M46S"
"W3u7wicMzHM","Retail sector contribution drops to 7% from 10%","2017-09-14T03:30:56.000Z","Kenya NTV","PT1M16S"
"kTSlGCgF2nM","Meet The Democrats AGAINST Medicare-For-All","2017-09-14T00:45:29.000Z","The Young Turks","PT5M52S"
"lYKSAGppZas","When limiting access to violent extremist videos could be erasing evidence","2017-09-13T23:32:47.000Z","PBS NewsHour","PT7M58S"
"eKeo2m5A1mQ","Seemingly drunk UHURU calls MARAGA ""MWIZI WA KURA"" & RAILA ""MGANGA"" to the Kisii community","2017-09-13T22:37:40.000Z","Kenyan Youtube Trends","PT1M33S"
"jI_SDK0FQss","Will Antifa Launch Terrorism On November 4th?","2017-09-13T21:22:03.000Z","War Room","PT6M51S"
"-mpMZ-RmWAc","DAVID MUSILA ADDS NO VALUE IN NASA 2017","2017-09-13T20:55:05.000Z","KENYAN EXPOSED NEWS","PT36S"
"76Bb8DbqXDw","""WE ARE IN NASA TO STAY'' GUSII LEADERS DENOUNCE UHURU AND JUBILEE RIGHT AFTER RECEIVING HANDOUTS","2017-09-13T20:10:32.000Z","Gazlam","PT3M4S"
"4mKOWXD07zM","NO MORE BUYING OF VOTES IN NYANZA ~YOU WILL FACE THE WRATH OF STONES THERE IF CAUGHT","2017-09-13T19:49:32.000Z","KENYA LATEST NEWS 2017","PT1M51S"
"Gg5F1UWnfY4","Jeff Koinange Live - With Hassan Omar (PART 1)","2017-09-13T19:44:59.000Z","Jeff Koinange Live","PT31M41S"
"G3S59EvF5Q4","GUSII MEET UHURU AT STATE HOUSE","2017-09-13T19:37:58.000Z","KENYAN EXPOSED NEWS","PT6M25S"
"PbOMHXpW36E","KIENGEI ROAST MUNYA 13 Sept 2017 - Mawoshimeni Makirangira","2017-09-13T19:17:58.000Z","ChannelYakele","PT7M23S"
"Yn06142bSws","SHOCK AS KISII ""LEADERS FIGHT AND SCRAMBLE FOR FOOD"" IN STATE HOUSE","2017-09-13T18:57:19.000Z","KDRTV News Kenya","PT1M20S"
"9L41_O38HHA","MQM Altaf Hussain 13th September 2017 Latest Audio Speech #MQM","2017-09-13T18:52:08.000Z","Social Media Tube","PT44M15S"
"NzV__FYpk_Y","Cobra snake used to stage witchcraft presented as evidence","2017-09-13T18:04:57.000Z","Kenya NTV","PT1M54S"
"ebvcO3jrEKQ","SHEMEER DHARIMI NOORUL HUDHA, TITANIUMMFIP LIVE 13/09/2017","2017-09-13T18:04:06.000Z","MFIP","PT2H19M7S"
"e_UXkvghhto","WE ARE A DEMOCRACY, WE CAN'T BE FORCED TO GO FOR  ELECTIONS THAT IS RIGGED","2017-09-13T16:44:26.000Z","Kenya News Alert TV","PT8M31S"
"BJmgIm3GMzA","Rais Kenyatta akutana na viongozi wa jamii ya Kisii","2017-09-13T16:40:32.000Z","Kenya NTV","PT3M39S"
"pVnKGI4blB0","Wabunge kutoka maeneo ya kaskazini mashiriki wadai kuwa Raila Odinga amehujumu maafisa wa serikali","2017-09-13T16:35:41.000Z","KTN News Kenya","PT1M42S"
"w8ALcDqc1AQ","THE SMILE WHEN UHURU SAYS JIPANGENI MPATE LUNCH","2017-09-13T16:20:08.000Z","Kenya News Alert TV","PT14S"
"znEibBxa9Gg","Awarding ng 2017 Sea Games Filipino Athletes sa Malacanang - Duterte Encouraging Message","2017-09-13T16:02:00.000Z","Pilipinas Updates","PT22M16S"
"Ia6YKNKmLoU","President Uhuru Kenyatta hosts delegation of Kamba and Bungoma political leaders","2017-09-13T15:27:24.000Z","KBC Channel 1","PT4M17S"
"vgiX4Pns994","Background Checks for Voting? Inside the Trump Election Commission's Contentious Second Meeting","2017-09-13T15:21:20.000Z","Democracy Now!","PT18M22S"
"-MEu_ZDlx04","Babu Owino meets uhuru ""wewe ndio unaandika barua za upuzi huku?""","2017-09-13T15:13:43.000Z","KENYA TRENDS","PT46S"
"ICuEWS10QNo","Uhuru tells Kisii leaders why he was mad with Maraga","2017-09-13T14:46:11.000Z","DailyNation","PT18M42S"
"PRBFf8VdPjc","Middlemen 'Rule' in Rythu Bazaar | Hitting Hard Consumers | vijayawada | Story","2017-09-13T13:52:16.000Z","ETV Andhra Pradesh","PT2M44S"
"Pjr-765kzVA","Renaissance capital: Stability pegged on Kenya's politics","2017-09-13T13:15:44.000Z","KTN News Kenya","PT3M39S"
"Ky6e7UJZZuk","UHURU SAYS HE HAS A PROBLEM WITH MARAGA NOT KISII PEOPLE","2017-09-13T12:52:41.000Z","Kenya News Alert TV","PT2M43S"
"c9OZ18Eaqak","Cancer survivor opens cancer centre in Kerugoya","2017-09-13T11:38:33.000Z","Kenya NTV","PT1M23S"
"9jEVlIIf5FQ","MPs in national assembly expected to form their house committee","2017-09-13T10:50:12.000Z","KTN News Kenya","PT6M20S"
"K1HixlxLKRk","Nara Lokesh Bumper Offers to Vizianagaram People | Lokesh Tour | AP Timez","2017-09-13T10:04:42.000Z","AP Timez","PT2M9S"
"ig_pGd3gbG4","Global Tv Kenya: Rais Uhuru Kenyatta Asema Anaheshimu Uamuzi wa Mahakama","2017-09-13T10:02:29.000Z","Global TV Online","PT4M25S"
"VBgx1KLXcvE","VOA news for Wednesday, September 13th, 2017","2017-09-13T09:53:05.000Z","ListenAndReadAlong","PT5M24S"
"R_WP-Cpub54","Josphat Nanok atoa amri kwa wauguzi","2017-09-13T09:41:50.000Z","KTN News Kenya","PT2M14S"
"Q-S7RqFDc2o","SPEECH WHICH MADE STATE DETACTIVES TO ARREST SEN MUTHAMA","2017-09-13T09:33:30.000Z","KENYA LATEST NEWS 2017","PT5M24S"
"FaT4vxnaLuk","FULL VIDEO: House approves P1,000 budget to CHR for 2018","2017-09-13T08:27:54.000Z","Manila Bulletin Online","PT12M55S"
"-4twOZcdsHA","KTR Vs LOKESH, MOTIVATIONAL KTR, KTR speech","2017-09-13T08:27:54.000Z","karthik m","PT54S"
"JOPc9zYv8q0","National assembly to begin sittings today","2017-09-13T07:47:54.000Z","KTN News Kenya","PT13M23S"
"7NUqYnLbLQ0","Confusion rocks Jubilee as NASA Exposes Uhuru plans to remove Presidential term limit.","2017-09-13T06:44:14.000Z","Phelix Ochola","PT1M42S"
"uo4a5ac5M_c","Moses Kuria and Johnstone Muthama charged with incitement to violence","2017-09-13T05:58:32.000Z","KTN News Kenya","PT6M17S"
"t2hgzn0GPtQ","What's behind Munya's about turn, Press review","2017-09-13T05:51:36.000Z","KTN News Kenya","PT5M24S"
"IysPWnUJNvU","Heritage Foods Silver Jubilee Celebrations |Chandra Babu Naidu| Bhuvaneseari |Lokesh |Brahmani","2017-09-13T05:22:17.000Z","Watch Ads","PT1M22S"
"ml-NjzmQlko","Simbu & Nayantara Telugu Movie ""Sarasudu"" Press Meet | T Rajender Speech | New Waves","2017-09-13T05:19:34.000Z","NewWaves","PT13M37S"
"qlb4TfYFgRY","CPM cultural rally during Sreekrishna Jayanthi  | Manorama News","2017-09-13T04:30:59.000Z","Manorama News","PT1M"
"MdwHZyRiQFE","MR SIFUNA TO UHURU K","2017-09-13T03:36:50.000Z","KENYAN EXPOSED NEWS","PT11M2S"
"qV0pQc4gSN0","1000's ATTENDS NASA SUPER MEGA RALLY AT KAMUKUNJI GROUNDS TODAY","2017-09-12T23:29:43.000Z","KENYA LATEST NEWS 2017","PT1H29M12S"
"SHEZPMyxZZs","Whats been happening in the Russia probe? Heres what we know","2017-09-12T23:06:32.000Z","PBS NewsHour","PT5M43S"
"sbklvGkCBPY","Raila Odinga GREAT  Speech Today In NASA Rally In Kibra Nairobi County 9 12 17","2017-09-12T20:40:36.000Z","Trending News Kenya","PT20M3S"
"QCL1hpaPM54","Ivan Ractic second goal Barcelona vs Juventus","2017-09-12T20:09:58.000Z","Ethio Kenyan","PT21S"
"P2X2Gb-x-o0","NASA MPs boycott Parliament opening ceremony","2017-09-12T18:38:41.000Z","Kenya CitizenTV","PT3M10S"
"KENk9AZNQzM","Apple's Tim Cook dedicates the new Steve Jobs Theater (CNET News)","2017-09-12T17:43:42.000Z","CNET","PT4M44S"
"_QASzyp3sVM","Muiritu wa wira kunyamario ni mumwandiki Eastleigh","2017-09-12T16:52:13.000Z","Kameme Tv Old","PT1M17S"
"sjYGVpNmZss","Impeaching the President: Why it may not be easy","2017-09-12T16:39:35.000Z","KTN News Kenya","PT4M6S"
"jKiY8EL0EH4","Commonwealth Powerlifting Championships | Telugu Girl Chandrika Gets Gold medal","2017-09-12T16:30:21.000Z","ETV Andhra Pradesh","PT1M29S"
"jTZSEDAAaec","UHURU KENYATTA FULL SPEECH ON 12th PARLIAMENT","2017-09-12T16:07:39.000Z","KENYA LATEST NEWS 2017","PT21M56S"
"ulxiK3GdNlM","ONE WORD TO THIS MAN  WHO INSULTED RAILA ODINGA & NASA AT LARGE","2017-09-12T15:35:10.000Z","KENYA LATEST NEWS 2017","PT1M56S"
