"video_id","title","published_at","channel_title","duration"
"ANhK0sQBU5o","FKF, government blame politics for mega CHAN-nce loss","2017-09-25T19:49:20.000Z","Kenya NTV","PT4M26S"
"c1TBeJsxu7A","Dog reunited with family after going missing two years ago","2017-09-25T19:30:01.000Z","CTV News","PT1M59S"
"5swrmuX43yA","SHOCK AS RAILA CALLS FOR MASS ACTION AGAINST IEBC OFFICIALS!!","2017-09-25T19:28:20.000Z","Small Prince Vlogs","PT1M19S"
"fJaybwWILVo","MUHOHO KENYATTA SHOCKED KENYA ON HIS COMMUNICATION SKILL","2017-09-25T18:57:37.000Z","KENYA LATEST NEWS 2017","PT52S"
"vCPMuSbSe9E","SENATOR JOHNSON SAKAJA DID THIS TO RAILA AND THE MT. KENYAN MAFIA ARE UNHAPPY!","2017-09-25T18:17:19.000Z","MTV East African News","PT4M5S"
"yEHc0hV2wHE","SHOCKING: Uhuru Kenyatta 's son Jaba can't speak Kiswahili","2017-09-25T18:13:20.000Z","Migori News","PT37S"
"fOEKs56uFms","DIASPORA DISPATCHES","2017-09-16T00:02:58.000Z","Kaba Mbugua","PT37M15S"
"-8uriuu0zkg","CAMP ANYONE.. ... .... F.E.M.A CAMP THAT IS...","2017-09-09T04:25:25.000Z","Anthony Banks","PT11M46S"
"dmZzFW-7IrI","Prayers, Protests For Charlottesville In New York","2017-08-14T01:28:43.000Z","CBS New York","PT50S"
"BETH8AJbI0k","Charlottesville declares state of emergency over unlawful  far-right rally","2017-08-12T17:11:14.000Z","RT America","PT2M40S"
"5E_Xfb0p4ow","3 homesteads in Kagira, Muranga County allegedly invaded by evil spirits","2017-06-15T10:33:17.000Z","K24TV","PT1M46S"
"kUTYSyd3LR0","ABANDONED city in America with NO LAWS | Yes Theory","2017-06-08T19:36:31.000Z","Yes Theory","PT10M19S"
"F2kwpCZm8sA","KENYAN PRIEST MISSION IN HAITI","2017-05-06T17:13:56.000Z","Kikuyu Diaspora Television USA","PT13M"
"gpTb3V0D9Is","Namanga border clashes: Kenyans along the border protest harassment by Tanzanian government","2017-03-28T11:23:51.000Z","Kenya NTV","PT8M33S"
"UUu_SORX2EU","Southern Cameroon Demo New York City","2017-03-03T22:04:09.000Z","lorolose","PT2H17M21S"
"E--9GaJ532o","Raila in Busia","2017-01-20T06:57:15.000Z","busia news update","PT4M4S"
"rTxaMnWOjnU","Road To Canaan The XYZ Show S8E4","2016-11-02T16:42:39.000Z","The XYZ Show Official","PT3M28S"
"qiJUaG_Iipw","Nyama Choma business in the U.S","2016-07-14T08:01:19.000Z","Kenya CitizenTV","PT3M41S"
"hiETIH5OFP4","Raila Odinga leads Cord protesters in the first non-violent Anti IEBC protest in Nairobi's CBD","2016-06-06T12:48:57.000Z","KTN News Kenya","PT5M15S"
"etMMzLHoEPc","Mombasa Anit-IEBC Protest","2016-05-23T14:11:55.000Z","Kenya CitizenTV","PT2M33S"
"h6z9xJJxFi4","15 CORD supporters arrested as police disperse anti IEBC demo","2016-05-16T15:23:16.000Z","Capital FM Kenya","PT6M28S"
"KoL9PGxGDPM","A TALE OF TWO FEMALE GANGSTERS","2016-05-14T13:15:21.000Z","Africa Uncensored","PT11M6S"
"feqPisU9yxE","Kisumu Killer Gangs : Killer gangs wreaking havoc in Kisumu","2015-10-12T19:05:24.000Z","K24TV","PT14M40S"
"3gKPYjhSwVY","Kenya: Police TEAR-GAS school children at playground protest","2015-01-19T17:23:51.000Z","Ruptly TV","PT1M22S"
"lUjOdjdH8Uk","Al Jazeera Investigates - Inside Kenya's Death Squads","2014-12-08T02:04:33.000Z","Al Jazeera English","PT47M30S"
"Qlw8Yfjl2Zw","KENYAN ELECTION VIOLENCE PART 1","2013-07-11T21:58:23.000Z","Tom Trigga","PT15M5S"
"MjcGFUoaVcY","CORD'S MUTHAMA IN KIBERA: VOTE CANT BE STOLEN AGAIN!","2013-03-13T15:46:28.000Z","NITHI EVES","PT5M41S"
"H8ka-aa4dac","Politics News - New York State Assembly, Kenya, Hugo Chavez, Barack Obama","2013-03-06T22:06:32.000Z","Wochit News","PT1M4S"
"Mmp9FUuE1vA","Kisumu Riots Day 2","2012-10-31T02:14:08.000Z","Kenya CitizenTV","PT3M40S"
"tfKrKvJYKro","Kenyans in the U.S Speak out","2012-07-01T18:49:59.000Z","KTN News Kenya","PT5M37S"
"KAr36q-DL24","What is it like to be a Kenyan American?","2012-06-17T22:06:41.000Z","Jessie Karangu","PT10M44S"
"Blckpwk1voQ","Donald Trump - Obama Birth Certificate - Greatest Scam","2011-04-07T15:43:16.000Z","Ringo Starr","PT2M13S"
"0UhmXAvh2y0","Mungiki Issues Threats","2009-10-28T23:47:27.000Z","Kenya CitizenTV","PT2M21S"
"S4WaN0PJ0ZY","Bulls Eye - Kenya Political Satire NTV 250708","2008-07-28T03:27:48.000Z","mugaya newton","PT6M33S"
