"video_id","title","published_at","channel_title","duration"
"loAYbGt2mXQ","India's New President Ram Nath Kovind Speech About Independence Day | Delhi | Studio N","2017-08-14T14:29:58.000Z","Studio N News","PT5M32S"
"oupKhND4WGQ","YS Jaganmohan Reddy Speech in Nandyal | 6th Day Road Show | Studio N","2017-08-14T14:29:00.000Z","Studio N News","PT3M6S"
"FK60JGpoq6c","Raila Odinga's speech - Nasa Rally - Kenya Election - 13 August 2017","2017-08-14T05:48:52.000Z","Povo News","PT1H14M8S"
"MfCqecm4Emc","HD Scientific Reasons Why We Never Landed on the Moon [FULL VIDEO]","2017-08-13T17:54:42.000Z","Harrington Peterson","PT57M28S"
"70GnzHelc8M","Has Raila Odinga Flown to Tanzania for Swearing-In Ceremony?","2017-08-13T01:01:00.000Z","makozewe","PT3M10S"
"wiUPiHfjqs4","Violence Erupts In Kenya Following Kenyattas Win","2017-08-12T20:12:46.000Z","Gina Kennedy","PT52S"
"681Kb8lxRTM","Breaking News  Shock Mega 6 2 Quake Shakes Philippines","2017-08-12T14:42:34.000Z","NASA, SPACE & ASTRONOMY VLOGS","PT4M8S"
"w1SBdKRynpc","Breaking News  Massive Black Sky Drills 2 Days After Eclipse, 1 Month Before Revelation","2017-08-12T14:16:34.000Z","CNN,BBC FOX News","PT10M11S"
"pDrUlKwyxxM","YS Jagan Campaigning in Nandyal | Nandyal By Election | Studio N","2017-08-12T11:28:57.000Z","Studio N News","PT15M33S"
"u1UAmQD92wM","President Uhuru Kenyatta's speech while at Bomas of Kenya","2017-08-11T21:07:46.000Z","KTN News Kenya","PT10M41S"
"Z5yxdQT3jnI","RAILA GIVING HIS SPEECH.  PEACE eeee","2017-08-11T13:57:44.000Z","Karen Mk","PT31S"
"0dvOM7MK6tg","The National for Thursday August 10, 2017 | Brad Wall Resigns, Motorcycle Mob, Child Rapist Paid","2017-08-11T02:05:58.000Z","The National","PT59M50S"
"tBUDksUwlw4","Daawo Xildhibaan Yusuf Hassan oo ku Guulaystay Kursigii Kamukunji","2017-08-10T11:05:39.000Z","Qarri Jiqood","PT28M31S"
"CZW4sZYi6lM","Due diligence should be upheld for remaining process","2017-08-10T11:04:55.000Z","The Star Kenya","PT3M5S"
"wKM7gfR4fZE","Kenya election: Police fire tear gas as angry voters light tires in the streets","2017-08-10T10:50:31.000Z","IBTimes UK","PT1M7S"
"cNUsJFHvQ3Q","Rangaraj Pandey on TTV Dinakaran's Press Meet about the Resolution Passed by Tamil Nadu CM","2017-08-10T10:48:13.000Z","Thanthi TV","PT12M32S"
"Jyjiq5RyOkI","Sharad Yadav says Bihar has broken people's trust | Oneindia News","2017-08-10T10:35:34.000Z","Oneindia News","PT1M41S"
"GSAorsC_CDc","Kenya Elections: could the streets erupt into new violence like ten years ago?","2017-08-10T09:55:26.000Z","FRANCE 24 English","PT2M34S"
"iaZp_5_73OM","Minutes After Raila Said The Kenyan Election Was Hacked | The Real Raila","2017-08-10T09:55:01.000Z","The Real Raila","PT33S"
"973aL6wnrdU","DMK Family Drama : M.K Alagiri Lashes Out At Brother Stalin","2017-08-10T09:47:52.000Z","India Today","PT12M54S"
"1EUM3YKcMPE","Drama in Lamu as woman rep and politician reject results","2017-08-10T09:47:24.000Z","The Star Kenya","PT1M6S"
"wRO0g5Z2Y-A","Sabiti Joseph with An Update on Kenya Elections","2017-08-10T09:43:55.000Z","NBS TV Uganda","PT8M48S"
"5gN0mtzyyIU","What Nasa discussed with the AU observer mission","2017-08-10T09:13:21.000Z","Kenya NTV","PT3M29S"
"bhLYxbSfb2I","HII KAULI YA UHURU KENYATTA KUHUSU WIZI WA KURA IMEZUA MTAFARUKU MKUBWA SANA","2017-08-10T08:49:55.000Z","24hours","PT52S"
"A4z6VOd7PEU","Raila Odingas Political Journey","2017-08-10T08:23:16.000Z","NBS TV Uganda","PT5M23S"
"WDE9EKag8YI","Who is this #GitheriMan!!","2017-08-10T08:06:56.000Z","Mr. C.E.O","PT3M12S"
"zXIM6KzaJbk","EAC observers give polls a clean bill","2017-08-10T07:52:58.000Z","Kenya CitizenTV","PT1M15S"
"HckFmCr1wFg","Kenya Elections: Raila Alleges Hacking Of Electoral Systems","2017-08-10T07:52:33.000Z","Mujuni Raymond","PT2M44S"
"u-6MFOxGM2I","Dr. Narendra Jadhav's Speech | Rajya Sabha Chairman Md. Hamid Ansari's Farewell","2017-08-10T07:48:32.000Z","Rajya Sabha TV","PT1M44S"
"Xr4rTskv5mM","KENYATA AMSHANGAA ODINGA KUIBIWA KURA","2017-08-10T07:32:14.000Z","Bongo Hot News","PT1M4S"
"v7aKwTwU43Q","NAUFAL SAQUAFI KALASA KARNATAKA  BYARI SPEECH  HBJM MOORUGOLI Swalath Anniversary 2017","2017-08-10T07:24:53.000Z","Andu Poyyathabail New","PT2H33M13S"
"qbAdEKjdSso","99TV Telugu Live Stream","2017-08-10T07:00:38.000Z","99TV Telugu","P3DT8H12M6S"
"LB--ENQswcU","OMG! Beware While Buying SMART Phones |     | Latest Updates | VTube Telugu","2017-08-10T07:00:30.000Z","VTube Telugu","PT3M39S"
"2vUpF6pVCBI","Who has Bewitched You? PLO Lumumba","2017-08-10T06:46:17.000Z","Christ Intervention","PT2M17S"
"puY0_zvf564","Jubilee politician dismiss Nasa leaders on hacking claims","2017-08-10T06:45:00.000Z","DailyNation","PT56S"
"4XO72hAFjUg","TDP senior leader Motkupalli Narasimhulu to get Governor Post | Studio N","2017-08-10T06:44:42.000Z","Studio N News","PT2M21S"
"mfL-WbcfdLk","Duterte hits 'tonto' EU officials for 'believing' De Lima","2017-08-10T06:41:25.000Z","Rappler","PT1M14S"
"dvByRdmEzO4","Pakistan Ke PM Ko Dubai Ka Iqama Kyun Chahye? | Nadeem Malik Live | SAMAA TV | Best Clips","2017-08-10T06:16:42.000Z","SAMAA TV","PT1M58S"
"B8BAhEYqXhc","Hyderabad Task Force Police Arrested Drug Dealer Gabriel | Seized Laptop & Cocaine | V6 News","2017-08-10T06:14:56.000Z","V6 News Telugu","PT2M40S"
"s3AqIIf47GQ","Sushant Singh Rajput reveals his dream experience shooting at NASA for Chanda Mama Door Ke","2017-08-10T06:06:30.000Z","Bollywood Life","PT5M30S"
"N6CS0K7Ej-s","News News  CLINTON RELEASES 2015 TAX RETURN ON CNN Breaking News","2017-08-10T05:31:48.000Z","Dustin Man","PT3M55S"
"hEorhWfjpyo","Kenya election chief rejects claims of poll hacking","2017-08-10T05:19:07.000Z","Al Jazeera English","PT1M40S"
"1jkpudg6Brs","Shankersinh Vaghela to address Press Conference after Rajya Sabha Elections | Vtv News","2017-08-10T05:17:43.000Z","Vtv Gujarati News","PT2M23S"
"sGIeRY6zoQI","""Sandblasting techinque will damage the Inscription of Temple"" || Thanthi TV","2017-08-10T04:59:56.000Z","Thanthi TV","PT5M6S"
"5I6vYlyMzU0","Our next target is Gujarat assembly election, will work for it: Ahmed Patel - ANI News","2017-08-10T03:58:40.000Z","ANI News","PT1M16S"
"a-3gGKQ40l0","DUTERTE MUNTIK NG HIMATAYIN! DEFENDS PAOLO DUTERTE "" I'LL RESIGN IF INVOLVED ANG ANAK KO ""","2017-08-10T03:52:32.000Z","MAKABAYANG PILIPINO","PT1H33M14S"
"8NO2qfL-hMA","HOGA KAL SUNEHRA","2017-08-10T03:43:53.000Z","DPS Bokaro","PT3M5S"
"8Xw-wuvcL5I","CM Chandrababu & Governor Attends World Tribal Day Celebrations in Araku Valley | Teenmaar News","2017-08-10T03:05:44.000Z","V6 News Telugu","PT1M56S"
"CLQ2xdQ6JQw","Supermassive Black Hole","2017-08-10T03:04:04.000Z","Michael McIntee","PT49S"
"GIXQsjdDYKQ","Rains In Telangana | Heavy Rains To Hit State For Next 4 Days | Teenmaar News | V6 News","2017-08-10T02:59:14.000Z","V6 News Telugu","PT1M42S"
"96ckJFASKt8","IEBC receives more forms 34Bs including results from diaspora","2017-08-10T02:49:11.000Z","Kenya NTV","PT2M29S"
"5FjMi82EIaE","A Bangalorean Performed Lakshmi Pooja With 73 Lakh Currency Notes Bundles | Teenmaar News","2017-08-10T02:47:58.000Z","V6 News Telugu","PT1M27S"
"7NC0PjaPf1c","Hurdle For Haritha Haram As Thieves Cut Away Tree Guards | Teenmaar News | V6 News","2017-08-10T02:41:20.000Z","V6 News Telugu","PT1M28S"
"s8zGzKUI6MM","BAYAR THANGAL NEW LATEST ISLAMIC MALAYALAM SPEECH SSF Arabana Valavoor Thumbe 2017","2017-08-10T02:38:57.000Z","Andu Poyyathabail New","PT1H17M8S"
"eJR079jsgmo","Supporters celebrate election win after announcement of results in Baringo","2017-08-10T02:25:24.000Z","Kenya Election Update","PT46S"
"hZBdcE0J5xE","Kenya opposition links official's death to 'rigged' vote as Kenyatta leads in early results","2017-08-10T02:23:07.000Z","RBL channel","PT1M9S"
"e-cM41wWtkY","GARISSA DECIDES | HON: ADEN BARE DUALE - DECLARED THE WINNER OF THE GARISSA TOWNSHIP SEAT 2017-2022","2017-08-10T02:17:20.000Z","ABDI ASKARI TUBE","PT8M45S"
"MAavpjOjSUM","SEN. GORDON NAGULAT! PAOLO DUTERTE ISINABIT NG ISANG WITNESS na DRUGLORD TUMANGAP NG BAYAD","2017-08-10T02:11:19.000Z","MAKABAYANG PILIPINO","PT5H32M57S"
"BfFsIMeuL8c","SABMILU BOLO SONG by CHILAKALURIPET CENTRE AT MUPPALLA CENTRE 2017","2017-08-10T02:07:57.000Z","Meher Sudhakar","PT7M59S"
"UCnq7yUC7EY","Babu Owino is yet to receive his certificate","2017-08-10T02:01:01.000Z","kute543","PT2M48S"
"RSzmBK4YODE","Vaiko latest speech saying BJP cannot play its game in Tamil Nadu unlike other states","2017-08-10T02:00:46.000Z","DINAMEI","PT4M26S"
"Z70K3Yu1jh0","NAIROBI GOVERNOR EVANS KIDERO REJECTS 2017 ELECTION RESULTS AS SONKO IS PREVIEW TO NEW GOVERNOR","2017-08-10T01:49:37.000Z","DJPlutonik","PT13M45S"
"r-402yrfQw0","KenyaDecides: Confirmation of forms 34A  currently ongoing","2017-08-10T01:49:23.000Z","Kenya Election Update","PT19M35S"
"MwLY08OMiKI","PREMA VINDU AVATAR MEHER BABA MUPPALLA  CENTRE 2017","2017-08-10T01:37:07.000Z","Meher Sudhakar","PT6M52S"
"nyCIHTg799I","KenyaDecides: IEBC states that NASA haven't officially lodged complaints of system hacking","2017-08-10T01:28:19.000Z","Kenya Election Update","PT53S"
"TlsfuIPbRFI","Gichuki Mugambi celebrates","2017-08-10T00:11:47.000Z","Kenya CitizenTV","PT2M51S"
"uZz05V6ovEk","Patrick Wainaina Jungle set to become Thika Town MP","2017-08-10T00:08:12.000Z","Kenya CitizenTV","PT57S"
"w9RhVJiTAZ0","Mandago ,Oscar Sudi Celebrates","2017-08-10T00:03:30.000Z","Kenya CitizenTV","PT2M28S"
"nzb0KdT2UYY","KILLUR THANGAL NEW MALAYALAM SPEECH MANJANOTTU MAKAM UROOS 2017","2017-08-09T23:22:41.000Z","Andu Poyyathabail New","PT1H39M40S"
"Fin3Becj3bc","[REDACTED] Star Citizen Podcast #122 | Foundry 42 UK Sneaky Report","2017-08-09T22:58:54.000Z","BoredGamer","PT1H43M50S"
"716IzcozP1E","Raymond Moi acceptance speech after re-election","2017-08-09T22:44:43.000Z","The Star Kenya","PT2M32S"
"C3NzGedN1yY"," |  4       ","2017-08-09T21:53:22.000Z","Alghad TV -  ","PT1M42S"
"s4V3gOxzQdI","#IEBCResult: PROTEST BEGINs IN HURUMA OVER ELECTION RIG","2017-08-09T21:43:32.000Z","Kenya Election Update","PT59S"
"GFKP-nCHNlY","""RAILA IS THE FATHER OF DEMOCRACY .HE DESERVED PRESIDENCY"" USA LADY URGES KENYA TO FIGHT DEMOCRACY","2017-08-09T21:41:54.000Z","KENYA LATEST NEWS 2017","PT9M26S"
"U8b6f48vSs4","Uhuru Kenyata the president-Haiwezekani Raila kuibiwa kura kwa mara ya 4.","2017-08-09T21:00:17.000Z","UDSM CELEBRITIES.","PT23S"
"RmBgRxyH2II","#IEBCResults: A TRUCK WITH 300,000 PRE MARKED PRESIDENTIAL BALLOT PAPERS  CONFISCATED IN KILIFI","2017-08-09T20:22:06.000Z","Kenya Election Update","PT5M23S"
"b61PUuII94o","Rachel Shebesh urges leaders to accept results and move on","2017-08-09T20:13:37.000Z","DailyNation","PT1M2S"
"UONekRdncJc","Neo News Headlines | 12 Am | 10 August 2017","2017-08-09T19:33:16.000Z","Neo TV Network","PT5M59S"
"yaXekLJ2yHY","GASCON BUDGET NG CHR KULANG UMANO NAKATIKIM NG SUPALPAL kay IDOL RAFFY TULFO","2017-08-09T19:33:09.000Z","24Oras Nakatutok","PT14M50S"
"ni2wbFTiSdI","Tensions high over vote results in Kenya","2017-08-09T19:29:33.000Z","PressTV News Videos","PT2M44S"
"GS9Guf4mt-Y","#IEBCResults: Raila Odinga's supporters turn rowdy","2017-08-09T19:02:14.000Z","Kenya Election Update","PT1M39S"
"6KsGuGBF8AM","The performance by gubernatorial candidates in Bungoma following the recently concluded elections","2017-08-09T18:54:13.000Z","KTN News Kenya","PT2M10S"
"w_tdRbAfEtE","Boring Letter to Governor Baker","2017-08-09T18:43:45.000Z","Now You Know","PT2M9S"
"n65eCLw1JMg","Elon Musk wants to get people from NYC to D C  in under a half hour","2017-08-09T18:26:59.000Z","industry american","PT31S"
"DywgLi3cVeM","Ted Cruz PREDICTS North Korean EMP Attack On America! (2016)","2017-08-09T17:46:32.000Z","MALCOLMSREVENGE","PT24S"
"n3ntWq-qZRM","How Quit India Movement Helped India to Get Independence? || Story Board || Part 03 || NTV","2017-08-09T17:13:52.000Z","NTV Telugu","PT4M51S"
"WR0P6kOVgQU","PV Sindhu Gives Joining Order to CCL Commissioner as Deputy Collector in AP || NTV","2017-08-09T17:12:16.000Z","NTV Telugu","PT1M8S"
"_JRgr1QisDI","    ||      || NTV","2017-08-09T17:04:44.000Z","NTV Telugu","PT4M29S"
"onKJfqtip-M","The Reason Why Betty Kyalo & Hassan Joho Broke Up","2017-08-09T16:57:41.000Z","Ghafla Kenya","PT1M13S"
"-mzDpF0QBJ8","Raila Odinga's supporters turn rowdy","2017-08-09T16:54:18.000Z","New Vision","PT1M36S"
"lmCWloEWO50","Heavy Rains | World Tribal Day | TRS MLA Vs Ex MP | Maratha Kranti Morcha Rally | Teenmaar News","2017-08-09T16:42:59.000Z","V6 News Telugu","PT17M41S"
"OIr7AFkbQEU","NAIROBI WOMEN REP - Rachel Shebesh Congratulates Esther Passaris","2017-08-09T16:34:48.000Z","ChannelYakele","PT4M43S"
"FlFjwSs9ijU","#IEBCResult: JOHO ASK KENYANS TO IGNORE THE FAKE RESULT BY IEBC","2017-08-09T16:25:14.000Z","Kenya Election Update","PT1M38S"
"NKs8hFgINc8","SPEAKING WITH THE NEWS CHANNEL- NEW DELHI","2017-08-09T16:25:01.000Z","VO ID","PT5M53S"
"TCp_3o-tV44","Satyendar Jain Speech in Delhi Assembly on Delhi Government Mohalla Sabha's Implementation!","2017-08-09T15:45:10.000Z","AAP KI AAWAZ","PT11M15S"
"0EqzltcgUNE","Why - Sajjad Ali's Inspiration","2017-08-09T15:37:47.000Z","Sajjad Ali","PT3M46S"
"FgiXg_2CIC0","Mbeki declares Kenya's elections free, fair & transparent - 9 August 2017","2017-08-09T15:36:52.000Z","Povo News","PT1M4S"
"WCjkcRBlgJQ","Uhuru kenyatta on that winning feeling dissing Raila funny.. August 9, 2017","2017-08-09T15:21:50.000Z","DJ SPIKE THE BIGSHOT","PT23S"
"W77BnIy8ZFE","IEBC Commssioner Akombe addressing the media","2017-08-09T15:20:59.000Z","Kenya CitizenTV","PT2M4S"
"RA-I2h842zE","PETER MUNYA refuses to concede defeat to Kiraitu Murungi in Meru gubernatorial race;","2017-08-09T15:15:19.000Z","Kenya CitizenTV","PT5M31S"
"XmPA-8h849o","DUTERTE DEFENDS PAOLO DUTERTE ""I'll resign if involved anak ko!"" FULL Video at Phil Devt Forum 8/9","2017-08-09T15:14:49.000Z","DUTERTE LATEST VIDEOS","PT1H33M14S"
"sJqkVoSmyjQ","Our Reporter Sam Gituku updates from Bomas of Kenya","2017-08-09T15:14:30.000Z","Kenya CitizenTV","PT5M20S"
"t2o15frFmAE","BINUNYAG ANG KATOTOHANAN SA PAGKASAWI NI ALBUERA MAYOR ESPINOSA AT OZAMIZ CITY MAYOR PAROJINOG","2017-08-09T15:13:33.000Z","FILIPINATION","PT17M58S"
"LbuyblEWEkc","Early dance for Alfred Mutua","2017-08-09T14:53:17.000Z","KTN News Kenya","PT11S"
"amGGlTnAnsY","Don't subject Kenyans to unnecessary drama, Tuju tells Raila","2017-08-09T14:09:54.000Z","The Star Kenya","PT1M17S"
"8sxZmSwP1yE","IEBC Chair Chebukati  answering questions from Journalist","2017-08-09T13:59:54.000Z","Kenya CitizenTV","PT20M"
"g4shm8VsDQU","IEBC CEO Ezra Chiloba updating on the progress of the tallying at Bomas Kenya","2017-08-09T13:58:39.000Z","Kenya CitizenTV","PT12S"
"Ksco6TxOUdc","Stalin and Thirumavalavan meeting.! Govt to be dissolved soon.? - 2DAYCINEMA.COM","2017-08-09T13:41:37.000Z","2DayCinema","PT1M15S"
"QEpjqppjtws","EC's verdict would be urged in court: BJP Incharge Bhupendra Yadav on RS Elections | Vtv News","2017-08-09T13:26:01.000Z","Vtv Gujarati News","PT2M43S"
"oKJj7pWkgwg","John Kerry on Kenya elections: ""very impressed by the tallying process""","2017-08-09T13:21:02.000Z","FRANCE 24 English","PT33S"
"CmY7dWAqFmA","Democracy under attack by communal, repressive forces: Sonia","2017-08-09T13:11:03.000Z","iansindia","PT3M8S"
"lRQZVi2RUek","Mathare youth
protest after elections rigging claims","2017-08-09T13:02:40.000Z","Joji Wanyoike","PT19S"
"CblricSob0A","       ","2017-08-09T13:00:30.000Z","Red Pix 24x7","PT32M5S"
"MuZE4B8cnsU","Tirupati Students Demands Boycott Chinese Products in India | Once Again Quite India Movement","2017-08-09T12:49:52.000Z","Bhaarat Today","PT4M47S"
"5MGk_cUz2AA","IMD Director YK Reddy Face To Face | Monsoon Rains In Telangana | V6 News","2017-08-09T12:48:57.000Z","V6 News Telugu","PT5M14S"
"y-t_4_weWGM","Kenya tensions spike as opposition cries foul over vote result","2017-08-09T12:46:43.000Z","AFP news agency","PT1M22S"
"GodLFCyC3hM","Prsidentielle au Kenya: le sortant Kenyatta en tte, l'opposition crie  la fraude","2017-08-09T12:46:20.000Z","FRANCE 24","PT1M"
"2_e8FiD5suc","BREAKING NEWS: Independent presidential candidate Japheth Kavinga concedes defeat","2017-08-09T12:45:52.000Z","KTN News Kenya","PT2M59S"
"Ihd3uh6jUqo","Kings and Dynasties of India - Rulers of India and More History Videos - Mocomi Kids","2017-08-09T12:34:53.000Z","MocomiKids","PT51M7S"
"lC0hsE-Udxo","Kenya election: President Kenyatta takes early-lead against Odinga","2017-08-09T12:27:02.000Z","WION","PT7M2S"
"92c4nPmbWkU","YS Jagan Speech || Road Show in Kurnool || #NandyalByElection || NTV","2017-08-09T12:08:42.000Z","NTV Telugu","PT7M11S"
"DQRmBiKgVwQ","Marriage Team Stuck in Nemaligundla Canal | Prakasam District | Studio N","2017-08-09T12:06:47.000Z","Studio N News","PT56S"
"qEgBYSIEzUc","Nandyal By-Election: YS Jagan Road Show in Kurnool || Campaign || NTV","2017-08-09T11:57:10.000Z","NTV Telugu","PT1M12S"
"1Mfx8jIgaF4","Gun Found in Maharashtra Registration Vehicle at Tirupati Alipiri Checkpoint || NTV","2017-08-09T11:54:11.000Z","NTV Telugu","PT1M49S"
"dOpfS1xoYEY","OVIYA's REAL FAN CRYING FOR HER |    |   |","2017-08-09T11:47:03.000Z","CrazyGamingWithSenthil","PT38S"
"YzNEHVtR2Ek","What Happened When Soori Teased Ajith? 'Ji' Shooting Spot Flashback | Comedian Soori Tamil The Hindu","2017-08-09T11:30:16.000Z","Tamil The Hindu","PT6M8S"
"WXKEX5i2pxY","BREAKING NEWS ;  RAILA ODINGA AYAKATAA MATOKEO YANAYOENDELEA KUTANGAZWA","2017-08-09T11:22:59.000Z","Gervas Maro","PT1M9S"
"sBTcvPzJw1A","President Trump: 'North Korea Will Be Met with FIRE & FURY Like World Has Never Seen'  2017","2017-08-09T11:21:00.000Z","Huny Koimr","PT26S"
"hd6pwPI52so","LIVE: Yanayojiri Matokeo ya Urais Kenya","2017-08-09T10:55:20.000Z","Dar24 Media","PT28M29S"
"ahIVOdr5jV8","GALIT NA GALIT SI PAULO DUTERTE WITNESS IDINAWIT SA SHABU SHIPMENT GALING CHINA","2017-08-09T10:52:55.000Z","NEWS ARMY PH","PT11M35S"
"Lcy3QZJUjbI","RAILA ODINGA CLAIMS ON HACKERS MANIPULATING KIEMS SYSTEMS","2017-08-09T10:43:18.000Z","KENYA LATEST NEWS 2017","PT16M21S"
"Yf-BQSxzTKk","Rajya Sabha Monsoon Session  Time Slot: 14.52 to 15.11","2017-08-09T10:38:30.000Z","Rajya Sabha TV","PT19M"
"57qORCrMZPI","Akshay Kumar's Hilarious Speech At Vogue Beauty Awards 2017 | Bollywood Buzz","2017-08-09T10:38:12.000Z","Bollywood Buzz","PT3M33S"
"4OvLbf-Psig","KENYA ELECTIONS: It is Uhuru for Kenya","2017-08-09T10:29:46.000Z","New Vision","PT2M10S"
"HTm6fSv-Roo","President Trump Holds Briefing on Opioid Crisis with Secretary Tom Price 8/8/17  2017","2017-08-09T10:01:23.000Z","Huny Koimr","PT4M37S"
"qyqUScypeto","Vikram Goud taken into Custody | Vikram Goud  Gun Fire Case  | HYDERABAD | DECCAN TV","2017-08-09T09:49:50.000Z","deccan tv -  ","PT1M1S"
"EYq47GTlgj4","News Update Kenya election 2017 Raila Odinga says election systems hacked 09/08/2017","2017-08-09T09:41:27.000Z","ABCNews Tv","PT2M57S"
"CM68F6xCfKg","2017 Kenya Elections a Fraud - Opposition","2017-08-09T09:38:42.000Z","NBS TV Uganda","PT6M8S"
"e9hXzDkpeFY","Raila/Nasa dispute election kalonzo reckless statement","2017-08-09T09:21:26.000Z","Ledama Suke","PT5M47S"
"8oeW6pX5xiI","Varun Dhawan Promotes 'Toilet Ek Prem Katha' In A Funny Video | Bollywood Buzz","2017-08-09T09:06:39.000Z","Bollywood Buzz","PT1M10S"
"gf-tkD7eSs4","Kazungu Kambi protests against Kilifi county provisional results","2017-08-09T09:00:19.000Z","The Star Kenya","PT2M35S"
"rhWvJEsSNn4","President Trump Full Speech at the National Republican Congressional Committee Dinner 3/21/17  2017","2017-08-09T08:45:55.000Z","Huny Koimr","PT30M23S"
"2dKOMrkCqRc","Raila Odinga Rejects the 2017 Presidential Results,Terms Them as Fake","2017-08-09T08:39:48.000Z","Mkenya Forums","PT16M48S"
"hhEU_pOGLoQ","SAFE ESCAPE SMOKE HOOD -  WWW.ASE-SAFETY.COM","2017-08-09T08:34:54.000Z","Robert Coleman","PT1M12S"
"q5bJHg44PVI","Jaguar ashinda kiti cha ubunge jimbo la Starehe, Kenya","2017-08-09T08:07:20.000Z","SimuliziNaSauti","PT1M38S"
"LZMoE46FGG4","Emea college union magazine inauguration full video 2k17","2017-08-09T08:06:15.000Z","Parrot wedding Events","PT4M12S"
"Jc8pKlS-3qY","Kenyan General Election Affects Kibera Slums. interviews by donwilsonkibera.wordpress.com","2017-08-09T07:29:19.000Z","African. Times","PT7M59S"
"q2l6YUVkgHo","Kenya election 2017: odinga disputes 'fake' results - bbc news[BIKINI]","2017-08-09T07:16:24.000Z","NOBITA","PT5M35S"
"H_eYTL5lGhw","Fake Certificates : Agricultural Students Strike in Mahanandi | TV5 News","2017-08-09T07:12:21.000Z","TV5 News","PT4M42S"
"0ntlQRcxhwA","China   Modi  , , Nehru       India","2017-08-09T07:08:40.000Z","Indilinks News","PT1M56S"
"zwsYTy3eHUA","NASA SUPPORTERS RAILA DIDNT LOSE, THEY RIGGED HIM","2017-08-09T06:53:56.000Z","TrendingNow","PT35S"
"AuqaenYtvSI","DUTERTE GALIT NA GALIT KAY PAOLO DUTERTE! BOC IDINAWIT SI PAOLO NA TUMANGAP NG SOHOL NG ILIGAL","2017-08-09T06:40:38.000Z","MAKABAYANG PILIPINO","PT19M31S"
"LGCtzzdVGMU","Jubilee rebuffs Nasa's call to suspend results transmission","2017-08-09T06:24:07.000Z","The Star Kenya","PT12M33S"
"mQ7JZkPh5jM","Vaiko says, BJP    | Press Meet | 9/8/17","2017-08-09T06:15:28.000Z","Puthiya Thalaimurai TV","PT5M20S"
"Y0tA4__Xa-s","5 Minutes 25 News | 9th August 2017 | TV5 News","2017-08-09T05:58:58.000Z","TV5 News","PT5M54S"
"KNcwhwOVAws","Moon Craters Debunked 100% Proof","2017-08-09T05:46:01.000Z","Earl Pitts","PT34M29S"
"0gWVfC7yXmE","BREAKING NEWS! SEN. DRILON KINAMPIHAN SI COMELEC BAUTISTA! TAOHAN KASI NG LEBERAL PARTY","2017-08-09T05:35:14.000Z","MAKABAYANG PILIPINO","PT26M52S"
"9l70yYqjpp0","SANGKOT KAY COMELEC BAUTISTA KINABAHAN NA! ASAWA IBINIGAY SA NBI ANG LISTAHAN","2017-08-09T05:29:07.000Z","MAKABAYANG PILIPINO","PT38M46S"
"ohSrDHO137c","Caster Semenya dismisses IAAF's plan to reinstate gender testing","2017-08-09T05:26:18.000Z","africanews","PT1M33S"
"pl4jk_LKwbk","ABP Ananda Impact: The Youth arrested on the charge of harassing a girl by opening a fake","2017-08-09T05:25:42.000Z","ABP ANANDA","PT1M42S"
"XjtdQmFn9u0","Pakistan's Ex-PM Nawaz Sharif all set to lead rally today despite blast","2017-08-09T04:32:01.000Z","WION","PT1M44S"
"cziAASzahBE","KINABAHAN SI  VP LENI ROBREDO, SA PAGSIWALAT NG ASAWA NI COMELEC CHAIR ANDRES BAUTISTA","2017-08-09T03:43:07.000Z","Duterte Bohol","PT30M11S"
"jiHj0uYkeFI","Kenyan opposition leader Raila Odinga rejects early vote results","2017-08-09T03:21:51.000Z","SOMALI MEDIA TV","PT16M48S"
"9jseaIfeka8","Machakos governor Alfred Mutua maintains lead in race for top seat","2017-08-09T03:15:24.000Z","KTN News Kenya","PT3M55S"
"aag4MHSq7uA","Martha Karua gets whitewashed by former CS Anne Waiguru in Kirinyaga","2017-08-09T03:08:17.000Z","KTN News Kenya","PT1M18S"
"Rj1sHpaRARM","PRES DUTERTE GINISA NG MGA REPORTER SA KASO NI CHIEF BAUTISTA SA ALLEGED ONE BILLION HIDDEN WEATH","2017-08-09T03:01:10.000Z","JDBros","PT10M14S"
"LmvaceBkfpU","DON'T CRY FOR RAILA, CRY FOR YOURSELF AS KENYANS. GOOD PEOPLE ARE NEVER REWARDED..","2017-08-09T02:59:53.000Z","Kenya News Alert TV","PT8M33S"
"w9EN-NIJSLc","Actor Imman Annachi Hints Ajith Siva Fourth Collaboration | Thala | Tamil Cinema Hot News","2017-08-09T02:33:02.000Z","Entertamil","PT1M14S"
"F0TRwrE9y4E","SONG by Bro RAMCHANDER & GROUP RAMAYANNAPETA AT MUPPALLA 2017","2017-08-09T02:32:50.000Z","Meher Sudhakar","PT4M5S"
"Rs1G_S9HlPE","LORD MEHER - 9 & MEHERA- MEHER BOOKS RELEASED AT MUPPALA ON 6th JULY 2017","2017-08-09T02:17:02.000Z","Meher Sudhakar","PT14M"
"Is-9NEGaivU","2 SONGS  by VIJAYAWADA & VIJAYANAGARAM CENTRES  AT MUPPALLA 3017","2017-08-09T02:02:08.000Z","Meher Sudhakar","PT8M5S"
"gsgOesJk2KU","UK GOAN FESTIVAL LONDON 2017 - Part 4/11 - Rusaria de Douza / Seby Fernandes / Angelica Dsouza","2017-08-09T01:28:19.000Z","ArmchairGoa","PT12M6S"
"2OPf0VKlXeE","NAKAKAGULAT! PAOLO DUTERTE ISA SA PINANGALALAN NG BOC NA NAGBIGAY NG SUHOL","2017-08-09T00:38:33.000Z","DU30 Channel","PT10M14S"
"QDbreTnq6pk","Questions linger over high number of spoilt votes","2017-08-08T22:18:29.000Z","DailyNation","PT4M24S"
"EE_QePK9Q0M","Report: Hillary Clinton Wants To Be a Pastor","2017-08-08T22:02:48.000Z","Western Journalism","PT1M43S"
"JOg4LgnPMf0","IMBONI : U RWANDA NYUMVA Y'AMATORA","2017-08-08T21:18:49.000Z","RTV","PT57M51S"
"BOjlIjfGgVc","DEG DEG TIRINKA CODADKA DOORASHADA KENYA OO SOCOTO 2017","2017-08-08T21:17:53.000Z","Caweyska Video Prodction","PT18M8S"
"YUptyAwW4HA","URGENT! TRUMP ISSUED AN EXTRAORDINARY ULTIMATUM TO NORTH KOREA","2017-08-08T21:12:07.000Z","NEWEST NEWS NETWORK","PT6M28S"
"m7Yg1-VEPhc","Exclusive: Prof Anyang' Nyong'o caught on camera
 Voting For Uhuru Kenyatta","2017-08-08T19:23:09.000Z","Joji Wanyoike","PT1M10S"
"NoegKD_gvDw","WAITITU MEETS KABOGO ON VOTING DAY","2017-08-08T19:09:49.000Z","SAMUEL W MWANGI","PT38S"
"c1ZBuDQyDjU","Vote Counting Begins in Kenya Election","2017-08-08T18:47:24.000Z","Associated Press","PT1M1S"
"Nzh4GMTpnNg","KIFO ~ ONYI PAPAJEY(DJ KUON)","2017-08-08T18:31:26.000Z","KENYA LATEST NEWS 2017","PT14M30S"
"JBr7gEbUL4A","UHURU TAKES  EARLY LEAD","2017-08-08T18:30:46.000Z","Kenya News Alert TV","PT4M38S"
"zVIAz4XoZsE","Kenya Border Elections, Businesses Close at Malaba","2017-08-08T18:23:35.000Z","NBS TV Uganda","PT2M10S"
"LevcgpnGozU","BREAKING NEWS TODAY AUG. 9,2017: PANIBAGONG MGA KALANSAY NG MGA PIONATAY NG PAROJINOG NA HUKAY","2017-08-08T18:13:10.000Z","FEDERAL-DUTERTE PHILIPPINES","PT12M"
"-GlXduVs5YA","Kenya poll results start trickling in to Bomas tallying center","2017-08-08T18:09:04.000Z","Capital FM Kenya","PT2M45S"
"MuppJ_dj7rw","Cabsi Wayn O Laga Qabo Natiijada Doorashada Kenya","2017-08-08T17:40:51.000Z","SOMALI PRESS TV","PT4M46S"
"JrnVUTfE7Vk","watch Jacob Zuma singing after wining Motion of no Confidence","2017-08-08T17:38:21.000Z","ISIHLAHLA SAMABHINCA","PT1M54S"
"-nCyxF83qVs","WION Gravitas Segment 2: Decoding Kenya's Presidential election","2017-08-08T17:03:19.000Z","WION","PT10M16S"
"KUMvJ8Miy24","SATHAR PANTHALLOOR I KODINJI CHERUMUKK SPEECH I 06 08 2018","2017-08-08T16:52:01.000Z","LIVE GALLERY","PT1H2M38S"
"zH0rAaVP39g","Kenya elections: Results trickle in, Kenyatta takes the lead","2017-08-08T16:32:29.000Z","SABC Digital News","PT2M19S"
