"video_id","title","published_at","channel_title","duration"
"7YNXkktOiek","Size 8 KISSES DJ MO in Public and Kenyans Can't Handle the Public Show of Romance","2017-08-07T09:17:00.000Z","E News Kenya","PT1M10S"
"kwJGdgU8Unw","SURPRISING Gift To KTR By Kavitha | Latest Celebrity Updates | News Now","2017-08-07T08:32:01.000Z","News Now","PT1M25S"
"gICHj7f0Yag","2 bike riders injured in the bike collision at Pandaveswar","2017-08-07T08:22:34.000Z","ABP ANANDA","PT55S"
"kvy4pqcUups","Dilip Ghosh Warns TMC, in the counter attack Firhad Hakim says TMC party is not afraid of","2017-08-07T08:14:51.000Z","ABP ANANDA","PT1M14S"
"1acx4cP7rAY","The psychopath Illuminati And Their Love For God And Us","2017-08-07T07:37:15.000Z","UrBrain Wash TV","PT3M33S"
"jwQqbeJHZ3Q","Police High Security for Vamsadhara Project Protest in Sikkolu | Srikakulam district | Studio N","2017-08-07T06:59:45.000Z","Studio N News","PT1M48S"
"RJNQ48yamKo","Mattannur Municipal Council Election; Campaign Came to an End","2017-08-07T06:55:56.000Z","People TV","PT1M29S"
"bG6p8dwOmMI","The Secret Masonic Victory of World War Two   PART 6","2017-08-07T06:25:28.000Z","Dennis Wise","PT15M17S"
"1JxpHAqEWnQ","Suspense Over Pawan Kalyan's Decision on Nandyal By-Poll | Studio N","2017-08-07T06:22:14.000Z","Studio N News","PT1M45S"
"0-Nyq_1hPmA","Periya Idathu Penn - Episode 401 On Friday,04/08/2017","2017-08-07T06:01:00.000Z","Jaya TV","PT22M18S"
"vuroRCzcjhY","Sravana Masam : Devotees Offer Special Prayers In Temples | Warangal | V6 News","2017-08-07T05:54:30.000Z","V6 News Telugu","PT3M26S"
"qbGkr8tS-08","How well do Ivanka Trump and Melania Trump get along?","2017-08-07T05:28:54.000Z","Larry Klein","PT2M36S"
"3W2LMpwPyA4","Option (Spoken Word) by | John Lorenzo Arriola","2017-08-07T04:43:16.000Z","Creative Studio","PT3M7S"
"eltAv-YtnwI","Parents Furious With Rats All Over UWS Playgrounds","2017-08-07T04:24:05.000Z","CBS New York","PT1M40S"
"GlAp7r5DJdU","Lima ka tuig (Spoken Word) by | mc sarona","2017-08-07T03:13:29.000Z","Creative Studio","PT4M45S"
"796RB_Q0cQM","2012 vs 2017","2017-08-07T02:46:21.000Z","Nathan","PT53S"
"KfCoWvt4lXY","President Trump Breaking News Today 8/7/2017 , Kellyanne Conway , Clinton , Russia Probe","2017-08-07T02:37:12.000Z","Donald J. Trump News","PT18M47S"
"utW5uz703uk","Madhuban Murli LIVE - 7/8/2017 (Monday 7.00am to 8.00am IST)","2017-08-07T02:34:41.000Z","Madhuban Murli Brahma Kumaris","PT59M55S"
"6_qpSEPj-Dk","President Uhuru Kenyatta Prays During Jubilee Party Final Rally At Nakuru","2017-08-06T22:34:37.000Z","Africa Social TV","PT3M27S"
"n2ijUuFBzow","James Fetzer - The Deep State |Eric Bolling|Judy Wood|JFK|Wolfgang Halbig|Coast To Coast AM|EOD 52","2017-08-06T22:17:47.000Z","End Of Days","PT2H46M23S"
"mzAqg8U1Rsk","RadicalWatch - BJ Soper Rants To Militia About Bundy LIFE FORTUNE & SACRED HONOR - Bundy Ranch Drama","2017-08-06T22:00:55.000Z","CHAOS VIEW Archive","PT5M6S"
"yTRaPRAdmPQ","NORTH KOREA TEST HWASONG-14 ICBM WITH RANGE OF 10,000 KM MAY REACH MAJOR U.S CITIES","2017-08-06T21:05:19.000Z","Otha Hammonds","PT12M17S"
"CNOr9tHXWN8","Election Preparations : Pundits take a look at issues surrounding elections part one","2017-08-06T19:32:42.000Z","KTN News Kenya","PT30M31S"
"6LDIFcrT-FU","LIVE RECORDING BY OVIYA FANS : VIRAL VIDEO | OVIYA LOVES AARAV | OVIYA SPOTTED AT CITI CENTRE MALL |","2017-08-06T19:11:12.000Z","CrazyGamingWithSenthil","PT26S"
"3-DYZaJ3CSM","  |Lunar Eclipse 2017 |  |        , ","2017-08-06T18:43:45.000Z","Devotional Speeches Telugu","PT5M3S"
"5Ss-ASqy6oY","Breaking news August 6,2017 Five years after NASA rover landed on Mars","2017-08-06T18:22:04.000Z","oromo tube","PT1M41S"
"zZYf-v8Ff9Y","The John Moore Radio Show: Friday, 4 August, 2017","2017-08-06T18:21:49.000Z","jrliberty","PT1H38M21S"
"TCrilvFHg7M","IEBC officials hold special prayers ahead of the polls","2017-08-06T18:10:53.000Z","K24TV","PT2M35S"
