"video_id","title","published_at","channel_title","duration"
"1vj5UyFB31g","PRESIDENT TRUMP PROMISES TO BUILD A STRONG RELATIONSHIP BETWEEN CHINA AND USA","2017-11-09T16:17:22.000Z","Raila Odinga vs Uhuru Kenyatta 2017","PT57S"
"E9eLsMJ1dS4","President Trump: I Don't Blame China, but Blame Obama's and so for Unfair Trade","2017-11-09T15:19:59.000Z","Live Stream TV News","PT8M13S"
"msND2dkBcdU","UPDATE:EFFECT OF NASA ECONOMIC BOYCOTT, WHAT OPTION DO KENYANS HAVE","2017-11-09T13:24:56.000Z","Raila Odinga vs Uhuru Kenyatta 2017","PT23M35S"
"DQCzTqRk6ws","MADAMDAMING MENSAHE NI PANGULONG DUTERTE SA FILIPINO COMMUNITY NA NASA VIETNAM (FULL SPEECH)","2017-11-09T12:37:13.000Z","PH News Unfiltered","PT51M28S"
"atPO55TJOtI","Boycotting is a means of extorting bribes from top companies","2017-11-09T11:37:42.000Z","The Star Kenya","PT2M46S"
"3OgtodTPrks","Harish Rao Speech On SRSP Renovation Works At TS Legislative Council | Studio N","2017-11-09T11:24:14.000Z","Studio N News","PT5M39S"
"BeDx5FxJ7zI","IT Minister KTR Speech in Telangana Assembly Sessions Over Steel Plant in Bayyaram | Studio N","2017-11-09T11:07:40.000Z","Studio N News","PT5M53S"
"dDmn7HgRLJs","Nayini Narasimha Reddy speech in Telangana Legislative Council | Studio N","2017-11-09T10:46:34.000Z","Studio N News","PT5M49S"
"8UO4S7K-gTw","Private sector weighs in on the target of Nasa's economic boycott","2017-11-09T10:37:24.000Z","NTV Kenya","PT49M31S"
"T8Rf0xfTk-0","How to get $1000 AmazonCard - New Version 11/7/2017","2017-11-09T10:36:50.000Z","Amzn4You","PT1M27S"
"gGMKfRb3rlE","Raila Odinga meets congressmen as he begins US tour","2017-11-09T10:22:27.000Z","Kenya Updates","PT5M6S"
"LFc6ac8Mzj0","Kenyatta arrives in Runda to Condole with the Family of the late Governor Gakuru","2017-11-09T10:13:16.000Z","Kenya CitizenTV","PT5M35S"
"2BCVPKkHr_Q","Bunge la wananchi Mombasa: Mchakato wa NASA Mombasa","2017-11-09T09:10:21.000Z","KTN News Kenya","PT6M51S"
"PXDjOSlR60I","President Duterte delivers speech at the APEC CEO Summit 2017 in Vietnam","2017-11-09T08:57:30.000Z","PTV","PT23M11S"
"rjB8THgUvZg","President Trump Delivers a Joint Press Statement with President Xi Jinping","2017-11-09T08:24:31.000Z","The White House","PT17M42S"
"UN3xHTWcyxk","PRESIDENT TRUMP DELIVERS SPEECH IN CHINA","2017-11-09T07:49:37.000Z","Trump Dayz","PT29M34S"
"80jMU0b8PR0","Obama VS Trump Welcoming Ceremony in China! (Colossal Difference)","2017-11-09T06:03:26.000Z","Right Wing","PT5M39S"
"94o9GeUx7Y8","China, US sign record $253.5 bln deals during Trump visit","2017-11-09T06:02:20.000Z","CGTN","PT7M59S"
"vMuwt4bUgy4","Power Breakfast: Unending Power Struggle","2017-11-09T05:59:10.000Z","Kenya CitizenTV","PT49M21S"
"NFTf6f73uiI","LIVE: President Trump Joint Press Conference with President Xi Jinping, Beijing China 11/09/2017","2017-11-09T05:47:15.000Z","US Live Stream TV","PT18M42S"
"MleClltCt9w","President Trump Atends A Business Event With President Xi Jinping In Beijing, China","2017-11-09T05:28:44.000Z","Front Line News","PT30M47S"
"GDMcTCItQhU","President Trump Joint Press Statement with President Xi Jinping 11/9/17 Beijing China","2017-11-09T05:22:54.000Z","Trump White House","PT18M15S"
"nM-Xf5RVua4","LIVE: President Trump Business Event with Chinese President Xi Jinping 11/09/2017 Beijing China","2017-11-09T05:11:50.000Z","US Live Stream TV","PT30M35S"
"vnV3quZ0QKg","LIVE: Xi Jinping, Donald Trump attend Sino-U.S. business dialogue in Beijing","2017-11-09T04:41:38.000Z","New China TV","PT29M49S"
"LmFANLzSif0","Power Breakfast: NASA Game Plan","2017-11-09T04:36:03.000Z","Kenya CitizenTV","PT22M40S"
"GIkR9dUXBHI","Xi Jinping holds talks with Donald Trump in Beijing","2017-11-09T03:46:50.000Z","New China TV","PT5M57S"
"X7flefV8tec","President Bill Clinton On Dictators, Democracy, & Why We Need Immigrants More Than Ever","2017-11-09T02:37:49.000Z","Team Coco","PT6M43S"
"lpwFdBW-FwM","First Lady Melania Trump Visits Arts and Crafts Class in China","2017-11-09T02:32:19.000Z","LIVE SATELLITE NEWS","PT3M19S"
"FkRxai85Js8","First Lady Melania Trump Visits Fashion Craft Classroom in China","2017-11-09T02:23:18.000Z","LIVE SATELLITE NEWS","PT6M40S"
"JgY-v9Fqm9U","Nine Reasons Behind Raila Odinga's Invitation to Address US Congress","2017-11-09T02:03:14.000Z","makozewe","PT9M34S"
"SYU7HGdKkA4","US First Lady Melania Trump Arrives at School in China for Tour with Peng Liyuan","2017-11-09T02:01:38.000Z","LIVE SATELLITE NEWS","PT4M5S"
"nzFFMGcw72A","President Trump MASSIVE Welcome Ceremony in China, Beijing November 09, 2017","2017-11-09T01:46:39.000Z","Trump White House","PT12M59S"
"Na3lcejmqZ4","LIVE: Xi Jinping hosts welcome ceremony for Donald Trump in Beijing","2017-11-09T01:39:52.000Z","New China TV","PT19M18S"
"13jk8eNgsAc","Melania Wows Press As Her One Move Causes Chinese To Dub Her Americas Secret Weapon","2017-11-09T00:38:02.000Z","Breaking News Global  24/7","PT5M13S"
"vLLBCng5ErA","Why ICJ Boss Njonjo Mue Petition Against Uhuru Win Will Be Interesting To Watch","2017-11-09T00:35:54.000Z","Kenya Updates","PT2M6S"
"f4JIpoPDum8","It's Official, NASA Is Going Back To The Moon. And So Is Everyone Else!","2017-11-08T23:48:34.000Z","Fraser Cain","PT9M11S"
"KyWtlIXfUbM","Mumbi Briefs 9: Who Killed Governor Wahome Gakuru?","2017-11-08T22:37:43.000Z","Dr. Mumbi Show","PT22M13S"
"hcM_UqcorWM","Trump's Granddaughter Is A Star In China Because She Can Sing In Mandarin","2017-11-08T21:35:07.000Z","Buzz News","PT2M50S"
"uVdm8oj3qEU","Trump Restores US-Russian Com-Links After Moscow Warns Deep State Of Unacceptable Damage","2017-11-08T19:43:40.000Z","Lucid Dreamer","PT13M14S"
"_ebVwv-CYPA","JOY AND DANCE IN KISII AS NASA CANDIDATE RICHARD ONYONKO DEFEAT KIBAGENDI. JUBILEE FINISHED","2017-11-08T19:30:23.000Z","Lee Makwiny","PT38M55S"
"C3zmw_GRnzE","NASA leader - Odinga, wants for interim govt formed","2017-11-08T19:03:41.000Z","Kenya CitizenTV","PT3M25S"
"sIHrBjkUxf0","Some Beijing residents comment on Trump's visit to China","2017-11-08T18:19:08.000Z","CGTN America","PT3M12S"
"nwAze35ybVk","BREAKING: Bill OReilly Issues Major Warning to GOP, This Is Urgent - TODAY NEWS","2017-11-08T17:13:43.000Z","TODAY NEWS","PT3M43S"
"pnzawNiI9Qw","President Trump & Melania Visting the Forbidden City in Beijing, China 11/8/17","2017-11-08T17:02:45.000Z","Front Line News","PT6M57S"
"cXhBDqy4fhk","BREAKING: Bill OReilly Issues Major Warning to GOP, This Is Urgent","2017-11-08T17:02:29.000Z","Breaking News Global  24/7","PT3M53S"
"3rQISrGKrgA","Telangana Congress Leaders Protest On Anti Black Money Day | VH Speech | Studio N","2017-11-08T13:27:12.000Z","Studio N News","PT1M51S"
"iKFAjBzRM_M","Bob collymore Angry as Nasa Supporter calls and delet his account!!!","2017-11-08T13:20:07.000Z","KENYAN TUBE","PT3M45S"
"4z32IBMWQmk","24 Oras: Pres. Duterte, nasa Vietnam na para dumalo sa APEC Summit","2017-11-08T12:16:32.000Z","GMA News","PT1M10S"
"KZrn6ZTDsY8","WOW! GRABENG INIT NA PAGSALUBONG KAY DUTERTE SA VIETNAM! MARAMING SALAMAT!","2017-11-08T11:58:09.000Z","Pro Duterte Ka Ba?","PT13M47S"
"XUdEVJbqKJA","Trump's election one year on: Many tweets, few big wins","2017-11-08T11:00:45.000Z","Al Jazeera English","PT2M27S"
"slyKk3WcCAI","Congress Leader Geetha Reddy Speech in Telangana Assembly | Studio N","2017-11-08T10:55:44.000Z","Studio N News","PT7M32S"
"xJb2s2H7RQE","Karimnagar MLA Gangula Kamalakar Speech at T Assembly Session | Studio N","2017-11-08T10:54:19.000Z","Studio N News","PT2M7S"
"Sl0Gi9K461k","Trump to North Korea: 'Your weapons are not making you safer' - BBC News","2017-11-08T10:38:56.000Z","BBC News","PT2M25S"
"dE9ig8wQjfY","MLA Of Koratla K Vidyasagar Rao Speech in Telangana Aseembly | Studio N","2017-11-08T10:31:57.000Z","Studio N News","PT2M52S"
"TOYItSHC6Ko","UNTV: C-News (November 8, 2017)","2017-11-08T10:24:27.000Z","UNTV News and Rescue","PT52M34S"
"XPR_6NWC-wQ","Minister Harish Rao Speech From TAssembly | Question Hour | Studio N","2017-11-08T10:16:41.000Z","Studio N News","PT7M21S"
"p1OtPrQO65k","Pre-departure ni Pres. Duterte | 
Duterte at Trump Magkikita sa 25th APEC Summit sa Vietnam","2017-11-08T09:42:08.000Z","Pilipinas Updates","PT31M5S"
"N0vTJi48B_g","Suba South MP John Mbadi: Ugandan forces are taxing Kenyan fishermen in Lake Victoria","2017-11-08T08:41:07.000Z","KTN News Kenya","PT6M14S"
"3g8mOn5LPZY","LIVE: Donald Trump arrives in Beijing for first state visit to China","2017-11-08T06:57:47.000Z","New China TV","PT14M6S"
"-BXYZEtM_zY","NASA leader, Raila Odinga proposes dialogue with Uhuru Kenyatta","2017-11-08T06:51:19.000Z","KTN News Kenya","PT1M44S"
"4qDNCFfktOI","NASA leader, Raila Odinga in US, yet to meet congress leaders","2017-11-08T06:49:29.000Z","KTN News Kenya","PT1M52S"
"pcpUyEDZsbY","Congress Leader Revanth Reddy to plans public meeting in Kodangal Constituency | Studio N","2017-11-08T06:48:34.000Z","Studio N News","PT2M42S"
"--FhVIOgcVk","PM Narendra Modi ji message today's for the public         ","2017-11-08T05:06:56.000Z","Modi Yogi","PT7M13S"
"yO-9K9VLq2U","One year of demonetisation: PM Modi states benefits of the move via video online","2017-11-08T03:40:27.000Z","ABP NEWS","PT9M34S"
"m_l0h2JUYf8","How FAR will A.I. GO?/Stephen Hawking Speech at WEB Summit 11/7/2017","2017-11-08T02:14:30.000Z","Morning D.E.W.","PT9M16S"
"9XNARurlsnY","How Bezos, Branson and Musk Pay for Space Race","2017-11-07T23:31:54.000Z","Bloomberg Technology","PT3M4S"
"5wjd2uxrTMs","Daily Blast LIVE | Tuesday November 7, 2017","2017-11-07T22:46:52.000Z","Daily Blast LIVE","PT3H8M58S"
"fwxYUOEayYY","Panic after Somali mp says this about RAILA!!!","2017-11-07T20:13:56.000Z","KENYAN TUBE","PT2M40S"
"TFPkJMdQ5tE","NTV Tonight November 7, 2017","2017-11-07T19:45:58.000Z","NTV Kenya","PT1H12M21S"
"ZvHjidjLcWY","Petition filed in kenya court challenging kenyatta's election victory","2017-11-07T19:22:14.000Z","Current Affairs","PT3M50S"
"3LL56iLaYyg","Revanth Reddy Birthday Wishes  || Happy Birthday To Telangana Tiger Revanth Reddy","2017-11-07T18:54:09.000Z","KNR Media","PT1M19S"
"oxLVWKWucZA","Who will suffer the biggest loss in Economic boycott?","2017-11-07T18:42:35.000Z","K24TV","PT2M56S"
"oeN8t_1eihA","Bernie Sanders Official REVEALED: Support Hillary Or Face Backlash Like Donna Brazile","2017-11-07T18:18:40.000Z","WORLD BROADCAST","PT2M10S"
"lighfcGFg2o","What next for Nyeri after the death of Dr. Wahome Gakuru","2017-11-07T18:16:54.000Z","KTN News Kenya","PT3M25S"
"a90AFeK_fe0","Governor Wahome Gakuru died following a traggic road accident","2017-11-07T16:09:24.000Z","Tuko / Tuco","PT4M16S"
"Lm2l8z3lPyI","Rais Uhuru Kenyatta, Ruto na Rais mstaafu Kibaki wamwomboleza","2017-11-07T16:02:58.000Z","K24TV","PT3M48S"
"_l-yKYA1H2I","      12     ","2017-11-07T15:44:37.000Z","HawkFeed","PT11M1S"
"ov0gjCZ8Tes","Wetangula's English at a press conference shocks many","2017-11-07T15:28:19.000Z","ARAP KALYA","PT3M27S"
"m33NII90fCg","NASA UPDATE:PEOPLES ASSEMBLY TO START OPERATING","2017-11-07T14:15:45.000Z","Raila Odinga Dayz","PT5M5S"
"IgOfn4Y-oGs","FOX NEWS LIVE - FOX NEWS LIVE UPDATE TODAY","2017-11-07T12:56:32.000Z","Fox News Live HD","PT0S"
"s0TOec5_8vE","YS Jagan Speech On 2nd Day Of Paada Yatra | Part 2 | Studio N","2017-11-07T11:47:59.000Z","Studio N News","PT6M29S"
"HNfwVRF4U9o","CM KCR Speech on Sada Bainama Regularisation at Assembly Meeting | Telangana | Studio N","2017-11-07T11:42:38.000Z","Studio N News","PT6M36S"
"p8i_LDFLDxQ","YS Jagan Speech On 2nd Day Of Paada Yatra | Part 1 | Studio N","2017-11-07T10:47:53.000Z","Studio N News","PT6M27S"
"I3Fjy-4bJqg","President Uhuru Kenyatta sends message of condolence to late Dr. Gakuru's family","2017-11-07T10:43:11.000Z","KTN News Kenya","PT3M2S"
"G2CIhAqKHKM","Three MPs accuse Nasa's Raila Odinga of attempting to extort bribes","2017-11-07T10:36:35.000Z","DailyNation","PT2M37S"
"wBeJ-K1bftM","     : Venkaiah Naidu Speech at Nannaya University | Studio N","2017-11-07T10:27:32.000Z","Studio N News","PT1M47S"
"NGmri3uYwOI","Otiende Amollo says Nasa's call to boycott products and services is succeeding","2017-11-07T10:27:28.000Z","NTV Kenya","PT2M46S"
"Mk61j5W3XCY","Anne Waiguru passes her condolences to family and Nyeri community of the late Dr. Wahome Gakuru","2017-11-07T09:56:00.000Z","KTN News Kenya","PT54S"
"e8VOgFI69zM","Deputy CM Kadiyam Sri Hari Speech On BAC Meeting | Studio N","2017-11-07T09:53:03.000Z","Studio N News","PT5M46S"
"cCMiqhco67Q","Rais Uhuru Kenyatta atuma rambirambi zake kwa familia na jamii ya mwendazake Gavana Gakuru","2017-11-07T09:49:14.000Z","KTN News Kenya","PT1M59S"
"TNyzi1cdbFY","Mahojiano ya mwenda zake Gavana Wahome Gakuru jana na mwanahabari wa KTN News, Betty Kyallo","2017-11-07T09:42:39.000Z","KTN News Kenya","PT6M2S"
"jor2jnyEocw","LATE NYERI GOV WAHOME GAKURU LAST WORDS BEFORE HIS DEMISE IN A ROAD ACCIDENT","2017-11-07T09:38:02.000Z","Raila Odinga Dayz","PT3M41S"
"VcpdvDJVuDY","Imkong L. Imchen speaks at Zeliangrong Students' Union Silver Jubilee, Delhi","2017-11-07T09:00:32.000Z","WildFilmsIndia","PT21M1S"
"nhUj2EXxbTQ","The last moments of Governor Wahome Gakuru","2017-11-07T08:58:41.000Z","KTN News Kenya","PT5M6S"
"RsV73ayPid4","Narendra Modi  Himachal  Congress     - Pm Modi latest Speech","2017-11-07T08:48:26.000Z","News Trend 24","PT23M9S"
"YcnPY7-gnQU","The Life and Times of Nyeri Governor Dr Wahome Gakuru","2017-11-07T08:34:21.000Z","Lee Makwiny","PT2M18S"
"YaWVzV8uIeQ","GOVERNOR WAHOME GAKURU LAST SPEECH BEFORE HIS DEATH!!","2017-11-07T08:04:54.000Z","News Tv","PT49S"
"20U5VN93lR8","Wahome Gakuru accident - photos","2017-11-07T07:50:52.000Z","ThePeterdev","PT2M34S"
"l0cDCyIbIFE","Narendra Modi   1       , crackdown on Benami Properties","2017-11-07T06:51:59.000Z","Pyara Hindustan","PT10M21S"
"SMNFQ4tLRFc","The Science Agenda to Exterminate Blacks","2017-11-07T05:37:41.000Z","TheHealthRanger","PT56M49S"
"tFa8vp573L8","NASA WARNING Position of Planet X Nibiru hit Earth on 7th November 2017, MUST WATCH","2017-11-07T01:37:44.000Z","Meisen D3","PT30M1S"
"d9xhUlUMGpI","WHO ELSE THINKS OBAMAS 2018 SALARY RAISE SHOULD GO TO THOSE ON SOCIAL SECURITY?","2017-11-06T22:55:52.000Z","BREAKING NEWS TODAY","PT2M40S"
"ZFAkwqQ7fVI","Developing Story: Activist Njonjo Mue files  petition","2017-11-06T18:28:08.000Z","KTN News Kenya","PT3M10S"
"in2sIhQhToE","Safaricom CEO CONFESS how they have lost 2.5 million customers!","2017-11-06T18:08:18.000Z","KENYAN TUBE","PT1M59S"
"Fo1J9qiX908","Serikali kutekeleza ahadi ya Rais Uhuru Kenyatta","2017-11-06T17:31:16.000Z","Kenya CitizenTV","PT1M23S"
"rfoVwrIWpwQ","Swaminarayan Akshardham Silver Jubilee Celebration, Gandhinagar, India","2017-11-06T17:14:52.000Z","BAPSChannel","PT25M34S"
"w3upIatlv_I","Over 5 million Kenyans employed by Safaricom affected by NASA boycott","2017-11-06T15:51:28.000Z","KBC Channel 1","PT3M8S"
"-jtdxBUXLks","Miguna Miguna Officially Devorce SAFARICOM, PROMISES TO VACATE UHURU KENYATTA FROM POWER!","2017-11-06T14:23:25.000Z","Lee Makwiny","PT3M16S"
"8GkE0d3611A","Uhuru & Raila 1st public meeting since repeat Kenya elections - 5 November 2017","2017-11-06T14:14:50.000Z","Povo News","PT1M43S"
"IAu1Qit4ksY","NASA boycott recipe for chaos - KUPPET Secretary General","2017-11-06T12:36:56.000Z","Migori News","PT1M49S"
"Jjr0XodEB9E","Super Star Rajinikanth welcome PM Narendra Modi To Chennai At DinaThanthi 75 Years Celebrations","2017-11-06T11:57:51.000Z","Chennaitv News","PT1M14S"
"EJnfqGZHhls","Dailythanthi 75 years- PM Modi Speech |       | Sun News","2017-11-06T10:46:10.000Z","Sunnews Live","PT3M52S"
"7YlEtOFSGiQ","PM Shri Narendra Modi's speech at public meeting in Palampur, Himachal Pradesh","2017-11-06T10:44:45.000Z","Bharatiya Janata Party","PT37M47S"
"vhbv0oKfWpE","Energy Minister Jagadish Reddy & Shabhir Ali Speeches From Legislative Council | Studio N","2017-11-06T09:00:12.000Z","Studio N News","PT8M31S"
"9_yfQtDigPQ","Thalapathy Vijay Is King Of Karnataka No More Place For Thala Ajith|   ","2017-11-06T07:33:47.000Z","Nettv4u Reviewboard&News","PT3M2S"
"QoBqvyUMKNM",",    :    |DailyThanthi|PM Modi","2017-11-06T06:50:21.000Z","Puthiya Thalaimurai TV","PT1M19S"
"zf_2w5fTKzI","PM Narendra Modi presenting Life Time Achievement Award to a Newspaper Hawker in Chennai today","2017-11-06T06:43:33.000Z","Modi Kumar","PT2M26S"
"N76p7Y3xZ6w","Live-  PM attends 75 years celebration of 'Daily Thanthi', Chennai | Modi Latest Speech","2017-11-06T06:43:16.000Z","Political Dangal","PT28M50S"
"XHVz8C0glrc","Narendra Modi latest speech,    Superstar Rajinikanth       ","2017-11-06T06:32:15.000Z","Pyara Hindustan","PT25M45S"
"wsQQL8btdqQ"," ,  :    |DailyThanthi","2017-11-06T05:48:47.000Z","Puthiya Thalaimurai TV","PT7M56S"
"ehBBArrlts0","06 NOVEMBER 2017      | #Today_Latest_News | NEWS HEADLINES | #DBLIVE","2017-11-06T05:47:25.000Z","DB Live","PT2M12S"
"lMcHuo6BVt0","Babu Owino in TROUBLE again after saying this.. |FlipTv","2017-11-06T05:25:23.000Z","Flip Tv Kenya","PT2M15S"
"Y7ZuxyctHB0","          Pm Modi | Narendra Modi emotional speech seen Crying","2017-11-06T05:14:33.000Z","Modi For 2019","PT20M10S"
"c275uwJKncQ","        ! #chennairains | Tamil news","2017-11-06T04:00:03.000Z","Top News - Tamil","PT1M17S"
"mb1sB_ddWb8","!!","2017-11-06T02:15:38.000Z","","PT10M13S"
"bc0IXSWAFVE","SEN BONNY KHALWALE THREE STERN OPTION TO JUBILEE BEFORE THE CLOCK END","2017-11-06T00:36:32.000Z","KENYA LATEST NEWS 2017","PT7M57S"
"75YJ89eyX5s","JAMES ORENGO CROWD MOVING SPEECH AT KIBRA DURING BOYCOTT RALLY","2017-11-06T00:32:50.000Z","KENYA LATEST NEWS 2017","PT20M44S"
"uvq-kx-fVpQ","HIDDEN IN GOPS TAX BILL IS GIFT FOR CHRISTIANS TRUMP PROMISED THAT HAS LIBERALS HOWLING WITH RAGE","2017-11-06T00:00:02.000Z","The Next News Network","PT7M6S"
"pqFxc6it31c","KHALWALE HITS THE BULLS EYE,AMAZING SPEECH TO BE REMEMBERED!!!","2017-11-05T21:23:17.000Z","NEWS CUT","PT9M11S"
"vzfCaYi9yMo","24 Oras November 6, 2017","2017-11-05T20:00:02.000Z","TV Patrol 24 Oras","PT45M29S"
"iT5L6kr0nlI","WHY USA OPTED FOR RAILA ODINGA TO ADDRESS  THE CONGRESS??","2017-11-05T19:42:23.000Z","KENYA LATEST NEWS 2017","PT2M7S"
"u84TKgwBPtA","Checkpoint: Quest for Opposition- inclusive politics","2017-11-05T19:15:49.000Z","KTN News Kenya","PT19M47S"
"S8yF6OIUE1U","NASA RALLY IN KIBRA LEAVES JUBILEE SHOCKED","2017-11-05T18:51:02.000Z","Raila Odinga Dayz","PT56M19S"
"W4xl6FFsz1Y","CrossFire: Poll Aftermath-What next after Uhuru Kenyatta declared","2017-11-05T17:58:20.000Z","KTN News Kenya","PT16M4S"
"xx7t0TmC4p4","MGA HELICOPTER NI DUTERTE INILABAS NA PARA SA ASEAN SUMMIT","2017-11-05T16:30:11.000Z","LATEST NEWS PH","PT14M9S"
"QVqqIrz7O4o","Ulimwengu wa Raga waomboleza kifo cha Okombe","2017-11-05T16:26:54.000Z","KTN News Kenya","PT1M27S"
"8eT5SOp2eBc","Assam new Political Party / Prag News / latest video 2017","2017-11-05T16:09:12.000Z","News Update","PT2M45S"
"10u35rDh6ro","Breaking News Today , Trump Makes Shocking UN Move,Pres trump News Today","2017-11-05T15:36:12.000Z","President Trump Breaking News","PT4M18S"
"l8Ko4h09_H8","Orengo's IMPRESSIVE Speech in Kebra and Message from BABA |FlipTv","2017-11-05T14:49:57.000Z","Flip Tv Kenya","PT24M3S"
"EXhZJWUQEwU","Uhuru meets Raila and Maraga At All Saints Cathedral","2017-11-05T14:08:53.000Z","Joji Wanyoike","PT31S"
"VMJwxzvZpHk","James Orengo HINTS what Uhuru Kenyatta Should EXPECT!","2017-11-05T14:03:38.000Z","TopGuy360 KENYA","PT1M55S"
"gDZ0N02P75I","NASA Rally In Nairobi Live From Kibra","2017-11-05T13:42:57.000Z","cooliyee","PT30M42S"
"-uU0CoNcIsc","Chevella TDP Leaders Join Congress In Presence Of Revanth Reddy And Sabitha Indrakaran Reddy | V6","2017-11-05T12:55:23.000Z","V6 News Telugu","PT1M32S"
"9evo_46czWM","CENTENARY CELEBRATIONS AT ALL SAINTS CATHEDRAL - KIDS' SONG","2017-11-05T12:16:38.000Z","ONLINE COMMUNITY","PT3M7S"
"gP9dBx1TTPc","TV Patrol: Libo-libong security personnel sa ASEAN Summit, dumalo sa send-off","2017-11-05T12:13:59.000Z","ABS-CBN News","PT1M44S"
"sd6MtLQ3MF8","Destruction of tea companies continues following the ongoing tea workers' strike","2017-11-05T11:43:35.000Z","KTN News Kenya","PT2M48S"
"0x8ilcsK6LY","Sambit Patra replied of Rahul Gandhi's tweet of attack on PM Modi","2017-11-05T11:30:10.000Z","Samay Live","PT2M52S"
"hyaZzqWN1-8","24 Oras November 6, 2017","2017-11-05T11:00:21.000Z","24 Oras","PT40M16S"
"xxmgUiRjHAU","PM Narendra Modi latest speech in Kullu Parivartan Rally Himachal Pradesh    ","2017-11-05T10:50:45.000Z","Modi Yogi","PT45M19S"
"BI2XMFvPLeY","UHURU AND RAILA MEETS AT CENTENARY CELEBRATIONS ALL SAINTS CATHEDRAL","2017-11-05T10:27:21.000Z","ONLINE COMMUNITY","PT1M42S"
"Pytx2H79nNI","Sa-adiyya Foundation Crystal Jubilee Inaugural Ceremony @ Bengaluru ON 05-11-2017","2017-11-05T10:09:37.000Z","Karnataka SunniOnline","PT1H41M22S"
"VWc6KvvzD7s","Rahul Gandhi Challenges Modi Over Heavy Prices | ABN Telugu","2017-11-05T09:15:11.000Z","ABN Telugu","PT55S"
"Txu9o7hyiQI","PM Narendra Modi latest Powerful speech in Palampur Himachal Pradesh | Huge Rally","2017-11-05T09:00:14.000Z","Modi Kumar","PT37M46S"
"v1xykPBFI7A","Minister Mahender Reddy Speech At Image Tower Foundation Stone Laying Ceremony | Hyderabad | TNews","2017-11-05T08:47:27.000Z","T News Telugu","PT2M12S"
"182vSmnIn1I","This is Why Uhuru kenyatta should be worried!!","2017-11-05T08:15:22.000Z","KENYAN TUBE","PT1M48S"
"ePZTxYqRJqE","Indian Railways: Rajdhani,Shatabdi passengers to be notified if train late by 1 hour | ","2017-11-05T07:53:14.000Z","Oneindia Hindi |  ","PT1M31S"
"fMEaFYcBGqw","Congress Has Run Away From The Battlefield, Says PM Modi In Himachal","2017-11-05T07:43:38.000Z","NDTV","PT2M10S"
"317SAm1VtTQ","Safaricom Customer asks for Raila's Bonga points as he migrates |FlipTv","2017-11-05T07:23:03.000Z","Flip Tv Kenya","PT2M27S"
"U_GY26a8Gk4","PROOF THAT Uhuru Kenyatta Hates Truth. HE FIRED MACHAGE AFTER TELLING HIM THIS UNTOLD TRUTH","2017-11-05T06:56:21.000Z","Lee Makwiny","PT9M30S"
"VrnfE01dHWM","Wow!!! 60,000-strong men Idedeploy para sa Seguridad ng Asean Summit | Send-off Ceremony","2017-11-05T06:32:30.000Z","Pilipinas Updates","PT25M43S"
"Z7oYvdkDaeM","Melody JKT48 LULUS ??? VLOG JKT48 Request Hour Setlist Best 30 2017  #6","2017-11-05T06:31:28.000Z","Team HAY48","PT6M5S"
"VaEuvdvJ7ng","Pm Modi Came 2 Kullu","2017-11-05T06:20:00.000Z","OmPk Tech Entertainment","PT10M13S"
"XhFo9rqHfvU","Modi come in india ","2017-11-05T06:16:07.000Z","Kulwinder kullu","PT24S"
"TyAFL5BUVpE","BT: Paglalayag sa Manila Bay, pansamantalang ipinagbawal bilang paghahanda sa ASEAN Summit","2017-11-05T04:55:30.000Z","GMA News","PT44S"
"u52VR9v7mog","BT: Seguridad sa ASEAN Summit, kasado na","2017-11-05T04:55:24.000Z","GMA News","PT6M29S"
"WleQGWCQTQI","CNN BREAKING NEWS","2017-11-05T04:45:14.000Z","CNN News","PT13M4S"
"uuYJ7q6gyxY","TRS Starts Operation Akarsh Again | TRS Attracting Strong Leaders Of Other Party | ABN Telugu","2017-11-05T04:13:01.000Z","ABN Telugu","PT2M51S"
"rfAnQvHaz6s","President Trump arrives in Japan 04November2017  NHK WORLD News","2017-11-05T03:04:39.000Z","nora langnhi","PT19M32S"
"r5i0eKUqZOM","Trump, Modi to discuss stucked deal on sidelines of E  Asia summit","2017-11-05T01:30:01.000Z","Defence Tube","PT3M4S"
"eCFC-OzKL5g","Saints Football vs UM-Western","2017-11-04T21:01:36.000Z","Carroll Athletics","PT2H55M36S"
"V04ZLIh2QPw","Mrc dismisses joho and kingi talk of secession for the coast","2017-11-04T17:25:25.000Z","  ","PT2M18S"
"xTq9y4FQ7DY","THE RETURN OF MIGUNA MIGUNA~NASA ON FIRE{JUBILEE DIDN'T SAW THIS COMING}","2017-11-04T17:03:44.000Z","KENYA LATEST NEWS 2017","PT5M4S"
"khwnTY-dRVc","Raila Furious after Jubilee killed cows in Laikipia","2017-11-04T16:59:34.000Z","noazi","PT15M40S"
"jpI7MvebM1M","Pm Modi        ,   modi latest speech","2017-11-04T16:13:30.000Z","APNA INDIA","PT3M16S"
"5mw_bR4eHew","Illuminati & Artificial Climate  | HAARP | Weather War  | in Tamil | Part 2","2017-11-04T15:43:13.000Z","Real Face","PT17M14S"
"9TEh2k3V4JA","        2017.BJP   ","2017-11-04T15:11:41.000Z","SARIF GUNDA","PT48S"
"RZc6uolB7VI","The Jim Bakker Show: Amazing Discoveries","2017-11-04T14:06:20.000Z","BongBang Channel","PT58M31S"
"KD1RdfvlkAg","India Under Modi Has Been Fantastic | World Bank president","2017-11-04T13:16:55.000Z","ETV Telangana","PT1M15S"
"UQmao-CVXpg","24 Oras: Roxas Blvd., pinaganda bilang paghahanda sa ASEAN Summit","2017-11-04T12:01:35.000Z","GMA News","PT1M"
"37zZWRzZP1w","Welcome To Calvary Temple-05-11-2017","2017-11-04T11:46:03.000Z","Calvary Temple Hyderabad","PT1M48S"
"iMTOmv2hEMA","SI Ramesh Adopts Loha Village In Komarambeem Dist | Provides Water Facility | Studio N","2017-11-04T11:44:46.000Z","Studio N News","PT3M6S"
"VYRm3HDk7Fs","#Memes || Chennai Floods ||  kalaignar || OPS|| Vadivelu","2017-11-04T11:30:20.000Z","Puipam [Tamil]","PT2M27S"
"V0WAJh3Wz_A","PM Modi addresses public rally in Sundernagar , Mandi , Himachal Pradesh","2017-11-04T11:01:03.000Z","Narendra Modi","PT41M29S"
"IZDw_vOoykE","sellur raju comedy today 04/11    interview","2017-11-04T10:20:18.000Z","Social Trend","PT1M48S"
"75I04ZbaOWU","Raila Odinga LIES to NASA supporters. He CONFUSES them like little children | TMZ Kenya.","2017-11-04T10:10:47.000Z","Tmz Kenya","PT2M22S"
"ywdRi900EdA","PM Modi  addressing public rally in Himachal  | Oneindia News","2017-11-04T09:51:22.000Z","Oneindia News","PT34M30S"
"hcDx_k7FsX8","Tamil Tv Morning 7:30AM News 04/11/2017 Tamil Tv Tamil HD","2017-11-04T09:00:35.000Z","Tamil Tv News","PT31M31S"
"WkF1XR3MC8w","SULTHANUL ULAMA KANTHAPURAM A.P USTHAD KAANANGAR MAKAM UROOS MUBARAK 2017","2017-11-04T08:43:20.000Z","Andu Poyyathabail","PT48M18S"
"6sHP1N05b5I","MANDERA COUNTY ASSEMBLY SUCCESSFULLY CONCLUDED VETTIN CECS","2017-11-04T08:19:25.000Z","Timeline News Alert","PT3M10S"
"30TC_ozS-Zk","Nuclear Attack on North Korea Is Imminent WW3 Will Be Catastrophic","2017-11-04T07:24:55.000Z","General News","PT10M10S"
"YpijHalWdMg","World Bank Rankings           New India ","2017-11-04T07:24:23.000Z","Narendra Modi","PT2M27S"
"jsLZpAbnOjY","World Bank CEO praises PM Narendra modi efforts and reform in India       ","2017-11-04T06:58:23.000Z","Modi For 2019","PT12M47S"
